2020-10-19 12:22:57,2020-10-19 12:37:43,IP Address,77.196.37.158,100,885,True,2020-10-19 12:37:44,R_XhTgPLQVN9HK8mt,,,,,43.641693115234375,5.0951995849609375,anonymous,FR,13300,Masculin,35 à 49 ans,fonctionnaire,"Profession libérale, cadre",Bac +3 (licence...),4,5300,5300,2,22,,Propriétaire occupant,,,NSP (Ne souhaite pas répondre),110,Électricité,La voiture,La voiture,La voiture,Un,,Diesel,"NSP (Ne sais pas, ne se prononce pas)",,10000,,,,,,,Il faudra modifier de façon importante nos modes de vie pour empêcher le changement climatique,,,à toutes les échelles,Très souhaitable,Très souhaitable,Très souhaitable,Très souhaitable,Très souhaitable,Très souhaitable,Oui,1,3,4,2,8,7,6,,Un peu,Autant à des processus naturels qu'à l'activité humaine,,,"Graves, car il y aurait plus de catastrophes naturelles",Chacun d'entre nous,Les plus riches,Les gouvernements,Certains pays étrangers,Les générations passées,Des causes naturelles,"Non, probablement pas",Plusieurs fois par mois,86,Beaucoup plus,L'obligation de rénovation thermique des logements les moins bien isolés assortie d'aides de l'État,Des normes plus strictes sur l'isolation pour les nouveaux bâtiments,Un renforcement du bonus/malus écologique pour l’achat d’un véhicule,L'abaissement de la limitation de vitesse sur les autoroutes à 110 km/h,"NSP (Ne sais pas, ne se prononce pas)",,,On peut faire confiance à la plupart des gens,l’indépendance,la tolérance et le respect des autres,la générosité,l’assiduité au travail,,,la responsabilité,,,,,9,Très souvent,10,10,10,Oui,Plutôt pas confiance,"NSP (Ne sais pas, ne se prononce pas)","Oui, je sais assez bien ce que c'est",150personnes disent ceux qui ils veulent changer et le proposent,Aucune mesure n'a été révélée à ma connaissance,Inutile car le gouvernement ne reprend que les mesures qui lui plaisent,,,,,,,,,,,,Non,,,,Ils sont moins écologistes,,,,,,,,,,0,0,0.928,0,"Oui, j'ai consacré toute mon attention aux questions jusqu'à présent et je pense que vous devriez utiliser mes réponses pour votre étude",,,,,,"Oui, tout à fait","Oui, tout à fait",Indifférent·e ou ne sais pas,"Oui, plutôt","Oui, plutôt","Oui, plutôt","Oui, tout à fait","Oui, plutôt",Oui,Oui,Oui,Oui,Oui,Oui,Oui,Oui,Oui,,,,,,2.898,29.419,30.053,12,Mon ménage ne serait pas affecté financièrement (gain de 0€ par an),,,Je suis sûr·e de ma réponse,"NSP (Ne sais pas, ne se prononce pas)",Ce chiffre semble trop élevé par rapport à la réalité,1.29,16.349,17.161,9,Non affecté,Je suis sûr·e de ma réponse,"NSP (Ne sais pas, ne se prononce pas)",Un peu,Jamais,,,,,,,,,,Apolitique,,,Je les soutiens,,,,Pas du tout favorable,Aucun,ce parti présente des candidats en qui j'ai confiance,1,2,2,1,2,2,2,1,2,2,2,Très constructive,,160959272039434,885,,3,PACA,0,0,1,72.4344839999999976498656906187534332275390625,6,0,72.4344839999999976498656906187534332275390625,0,10000,1,1,0,gouvernement,110
2020-10-19 12:18:28,2020-10-19 12:38:17,IP Address,89.3.14.46,100,1188,True,2020-10-19 12:38:17,R_1jkQEbrdgwDQI5G,,,,,48.8533935546875,2.3488006591796875,anonymous,FR,75011,Masculin,50 à 64 ans,retraité·e,Profession intermédiaire,CAP ou BEP,2,1500,4000,2,2,Locataire,,,,Entre 60 001€ et 180 000€,37,Électricité,Les transports en commun,La voiture,La voiture,Un,,Diesel,Mon véhicule consomme ... Litres aux 100 km :,6,25000,,,,,,,Il faudra modifier de façon importante nos modes de vie pour empêcher le changement climatique,,,à toutes les échelles,Pas vraiment souhaitable,Assez souhaitable,Pas vraiment souhaitable,Pas vraiment souhaitable,Pas du tout souhaitable,Assez souhaitable,Non,1,5,2,7,4,6,3,,Un peu,,est principalement dû à l'activité humaine,,"Désastreux, les modes de vie seraient largement altérés",,,Les gouvernements,Certains pays étrangers,,Des causes naturelles,"Oui, probablement",Plusieurs fois par an,61,Autant,L'obligation de rénovation thermique des logements les moins bien isolés assortie d'aides de l'État,Des normes plus strictes sur l'isolation pour les nouveaux bâtiments,,,,,"Non, je ne suis pas favorable à une augmentation de la taxe carbone",On n’est jamais assez prudent quand on a affaire aux autres,,la tolérance et le respect des autres,la générosité,,,,la responsabilité,,l’expression personnelle,l’imagination,,8,Assez souvent,6,7,10,Oui,Plutôt confiance,Oui,J'en ai entendu parler mais je ne sais pas très bien ce que c'est,une bande de cons qui se réunit pour faire plaisir aux écologistes de chez 'TOTAL',Je crois avoir entendu parler de mesures de la Convention mais je ne suis pas sûr·e,Inutile car le gouvernement ne reprend que les mesures qui lui plaisent,,,Une expérience vouée à l’échec depuis le début,Une opération de communication du gouvernement,,Une façon pour le gouvernement de se défausser de ses responsabilités,,Une assemblée manipulée ou contrôlée par le gouvernement,,,,Non,,,Ils sont plus écologistes,,Ils sont plus pro-gouvernement,,,,,,,,,,,,,,19.024,19.024,20.573,1,"Oui, j'ai consacré toute mon attention aux questions jusqu'à présent et je pense que vous devriez utiliser mes réponses pour votre étude","Oui, plutôt","Non, pas du tout","Oui, plutôt","Oui, tout à fait","Non, pas du tout","Non, pas du tout","Oui, tout à fait","Non, pas du tout",Oui,Oui,Non,Oui,Oui,Oui,"Abstention, blanc ou nul",Non,Oui,"Non, ça ne me dit rien","Oui, il me semble","Non, ça ne me dit rien","Non, ça ne me dit rien","Non, ça ne me dit rien",50.822,119.093,120.799,5,Mon ménage perdrait environ (en € par an) :,,390,Je suis moyennement sûr·e de ma réponse,Non,Ce chiffre semble trop élevé par rapport à la réalité,37.12,43.689,45.111,3,Perdant,Je suis sûr·e de ma réponse,Non,Un peu,Parfois,,,,De droite,,,,,,,,,,Je les comprends,,,Indifférent⋅e / Ne sais pas,Les Républicains,ce parti répond aux questions qui me semblent les plus importantes,8,8,6,8,3,6,7,6,7,8,9,non merci,,160959272103963,1188,,5,IDF,0,0,1,170.0339999999999918145476840436458587646484375,6,0,170.0339999999999918145476840436458587646484375,0,25000,0,0,1,EELV,110
2020-10-19 12:30:43,2020-10-19 12:39:20,IP Address,90.110.87.104,100,516,True,2020-10-19 12:39:21,R_2tM5KDE3izxoIsW,,,,,50.5386962890625,2.9579010009765625,anonymous,FR,59310,Masculin,65 ans ou plus,retraité·e,Retraité·e,Brevet des collèges,2,1700,1700,2,2,Locataire,,,,NSP (Ne souhaite pas répondre),70,Gaz de ville,Non concerné·e,La voiture,La voiture,Un,,Diesel,Mon véhicule consomme ... Litres aux 100 km :,6,15000,,,,,,,Il faudra modifier de façon importante nos modes de vie pour empêcher le changement climatique,,,mondiales,Assez souhaitable,Assez souhaitable,Assez souhaitable,Assez souhaitable,Assez souhaitable,Assez souhaitable,Oui,1,7,6,2,5,3,4,,Un peu,,est principalement dû à l'activité humaine,Il y aura des modifications de climat mais on s'y adaptera sans trop de mal,,,Les plus riches,,,,,"Oui, probablement",Plusieurs fois par an,72,Un peu plus,,Des normes plus strictes sur l'isolation pour les nouveaux bâtiments,,,,,"Oui, je suis favorable à une augmentation de la taxe carbone",On n’est jamais assez prudent quand on a affaire aux autres,,la tolérance et le respect des autres,la générosité,l’assiduité au travail,,,,la détermination et la persévérance,,l’imagination,,10,Assez souvent,8,8,8,Oui,Plutôt confiance,Oui,"Oui, je sais très bien ce que c'est",quelque chose qui a deja été abandonné,Aucune mesure n'a été révélée à ma connaissance,Inutile car le gouvernement ne reprend que les mesures qui lui plaisent,,,Une expérience vouée à l’échec depuis le début,Une opération de communication du gouvernement,,,,Une assemblée manipulée ou contrôlée par le gouvernement,,,,Non,,,,,Ils sont plus pro-gouvernement,,,,,,,,,,,,,,4.118,4.118,5.829,1,"Oui, j'ai consacré toute mon attention aux questions jusqu'à présent et je pense que vous devriez utiliser mes réponses pour votre étude",Indifférent·e ou ne sais pas,Indifférent·e ou ne sais pas,Indifférent·e ou ne sais pas,Indifférent·e ou ne sais pas,Indifférent·e ou ne sais pas,Indifférent·e ou ne sais pas,Indifférent·e ou ne sais pas,Indifférent·e ou ne sais pas,"Abstention, blanc ou nul","Abstention, blanc ou nul","Abstention, blanc ou nul","Abstention, blanc ou nul","Abstention, blanc ou nul","Abstention, blanc ou nul","Abstention, blanc ou nul","Abstention, blanc ou nul","Abstention, blanc ou nul",,,,,,23.251,33.843,35.561,5,Mon ménage ne serait pas affecté financièrement (gain de 0€ par an),,,Je ne suis pas vraiment sûr·e de ma réponse,Non,Ce chiffre semble trop élevé par rapport à la réalité,5.465,10.521,11.692,3,Perdant,Je ne suis pas vraiment sûr·e de ma réponse,Non,Beaucoup,Jamais,D'extrême gauche,,,,,,,,,,,J'en fais partie,,,,,Très favorable,France Insoumise,ce parti représente les gens comme moi,8,8,8,9,8,4,4,4,7,4,1,,,160959272040459,516,,2,Nord,1,0,1,207.0136519999999791252776049077510833740234375,6,104.9932519999999982474037096835672855377197265625,102.0203999999999950887286104261875152587890625,0,15000,0,2,1,EELV,0
2020-10-19 12:23:04,2020-10-19 12:43:05,IP Address,213.245.122.111,100,1201,True,2020-10-19 12:43:06,R_3MF0GfqIYFHhRgw,,,,,43.4069061279296875,5.054901123046875,anonymous,FR,13500,Masculin,65 ans ou plus,retraité·e,Retraité·e,"Bac +2 (BTS, DUT, DEUG, écoles de formation sanitaires et sociales...)",1,2100,2100,1,1,Locataire,,,,Moins de 10 000€,44,Électricité,Non concerné·e,La voiture,La voiture,Un,,Diesel,Mon véhicule consomme ... Litres aux 100 km :,6,13000,,,,,,,,"C’est aux États de réglementer, au niveau mondial, le changement climatique",,mondiales,Pas du tout souhaitable,Pas vraiment souhaitable,Pas vraiment souhaitable,Assez souhaitable,Pas du tout souhaitable,Très souhaitable,Non,1,,2,3,6,4,5,,Un peu,Uniquement à l'activité humaine,,,"Graves, car il y aurait plus de catastrophes naturelles",,Les plus riches,Les gouvernements,Certains pays étrangers,,,"Non, probablement pas",Presque jamais,60,Autant,,Des normes plus strictes sur l'isolation pour les nouveaux bâtiments,Un renforcement du bonus/malus écologique pour l’achat d’un véhicule,,,"Non, je ne suis pas favorable à une augmentation de la taxe carbone",,On n’est jamais assez prudent quand on a affaire aux autres,,la tolérance et le respect des autres,,l’assiduité au travail,,,la responsabilité,,,,,10,Assez souvent,6,1,7,Ça dépend qui et quels impôts,Plutôt confiance,Oui,J'en ai entendu parler mais je ne sais pas très bien ce que c'est,"Peu de Propositions retenues. ",Je crois avoir entendu parler de mesures de la Convention mais je ne suis pas sûr·e,Inutile car le gouvernement ne reprend que les mesures qui lui plaisent,,,Une expérience vouée à l’échec depuis le début,Une opération de communication du gouvernement,,,,Une assemblée manipulée ou contrôlée par le gouvernement,,,,Non,,,Ils sont plus écologistes,,,,,,"Non, ça ne me dit rien","Oui, il me semble","Oui, il me semble","Oui, j'en suis sûr·e","Non, ça ne me dit rien",0,0,7.45,0,"Oui, j'ai consacré toute mon attention aux questions jusqu'à présent et je pense que vous devriez utiliser mes réponses pour votre étude",,,,,,"Oui, plutôt","Non, pas du tout",Indifférent·e ou ne sais pas,"Oui, tout à fait","Non, pas vraiment",Indifférent·e ou ne sais pas,Indifférent·e ou ne sais pas,"Oui, plutôt",Oui,Oui,Oui,Oui,Oui,Oui,"NSP (Ne sais pas, ne se prononce pas)",Non,Non,,,,,,25.8,100.656,101.399,13,Mon ménage perdrait environ (en € par an) :,,88,Je suis sûr·e de ma réponse,Non,Cette estimation semble correcte,4.569,25.882,26.53,9,Perdant,Je ne suis pas vraiment sûr·e de ma réponse,Non,Un peu,Parfois,,,,,D'extrême droite,,,,,,,,,Je les comprends,,,Indifférent⋅e / Ne sais pas,Rassemblement National,ce parti répond aux questions qui me semblent les plus importantes,8,8,4,3,3,2,2,2,9,2,4,,,160959271583792,1201,,4,PACA,0,0,1,88.4176800000000042700776248238980770111083984375,6,0,88.4176800000000042700776248238980770111083984375,0,13000,1,0,1,gouvernement,0
2020-10-19 12:30:52,2020-10-19 12:43:44,IP Address,90.89.224.118,100,772,True,2020-10-19 12:43:46,R_2zimBJhnsnVTUvQ,,,,,44.3527984619140625,2.58050537109375,anonymous,FR,12170,Féminin,35 à 49 ans,fonctionnaire,Employé·e,"Bac +2 (BTS, DUT, DEUG, écoles de formation sanitaires et sociales...)",2,1670,1910,2,2,,Propriétaire occupant,,,Entre 60 001€ et 180 000€,87,"Fioul, mazout, pétrole",La voiture,La voiture,La voiture,Deux ou plus,,,,,,Essence,Essence,Mes véhicules consomment ... Litres aux 100 km :,6.5,18000,,Il faudra modifier de façon importante nos modes de vie pour empêcher le changement climatique,,,à toutes les échelles,Assez souhaitable,Très souhaitable,Pas du tout souhaitable,Assez souhaitable,Assez souhaitable,Très souhaitable,Oui,1,3,6,2,7,4,5,,Un peu,,est principalement dû à l'activité humaine,,"Graves, car il y aurait plus de catastrophes naturelles",Chacun d'entre nous,,,,,,"Non, probablement pas",Plusieurs fois par an,30,Un peu plus,L'obligation de rénovation thermique des logements les moins bien isolés assortie d'aides de l'État,Des normes plus strictes sur l'isolation pour les nouveaux bâtiments,Un renforcement du bonus/malus écologique pour l’achat d’un véhicule,,"NSP (Ne sais pas, ne se prononce pas)",,,On n’est jamais assez prudent quand on a affaire aux autres,,la tolérance et le respect des autres,la générosité,l’assiduité au travail,,,la responsabilité,la détermination et la persévérance,,,,5,Peu souvent,8,8,7,Ça dépend qui et quels impôts,Plutôt pas confiance,Non,J'en ai entendu parler mais je ne sais pas très bien ce que c'est,Je ne sais pas,Aucune mesure n'a été révélée à ma connaissance,,,,,,,,,,,Autre :,Je ne sais pas,"NSP (Ne sais pas, ne se prononce pas)",,,,,,,,,,,,,,,,,,,3.394,6.535,7.684,3,"Oui, j'ai consacré toute mon attention aux questions jusqu'à présent et je pense que vous devriez utiliser mes réponses pour votre étude","Oui, tout à fait","Non, pas vraiment","Oui, plutôt","Oui, plutôt","Non, pas du tout","Oui, plutôt","Oui, plutôt","Oui, plutôt",Oui,Oui,Oui,Oui,Oui,Oui,Oui,"NSP (Ne sais pas, ne se prononce pas)",Oui,,,,,,17.601,77.762,78.598,24,Mon ménage perdrait environ (en € par an) :,,90,Je suis sûr·e de ma réponse,Oui,"NSP (Ne sais pas, ne se prononce pas)",3.302,23.663,24.351,12,Perdant,Je suis sûr·e de ma réponse,Oui,Presque pas,La plupart du temps,,,Du centre,,,,,,,,,,,,Je m'y oppose,,Assez peu favorable,Aucun,ce parti répond aux questions qui me semblent les plus importantes,0,10,10,0,10,8,8,5,10,0,10,,,159900762480666,772,,1,Occ,0,1,2,310.16390789999996968617779202759265899658203125,7,194.93060789999998405619408003985881805419921875,0,115.2332999999999998408384271897375583648681640625,18000,0,3,1,gouvernement,110
2020-10-19 12:28:09,2020-10-19 12:46:01,IP Address,83.200.144.202,100,1072,True,2020-10-19 12:46:03,R_e9wVYiv49vk6a3v,,,,,46.42950439453125,0.264404296875,anonymous,FR,86240,Masculin,65 ans ou plus,retraité·e,Retraité·e,Brevet des collèges,2,1800,3400,2,2,,Propriétaire occupant,,,Entre 180 001€ et 350 000€,90,Gaz de ville,La voiture,La voiture,La voiture,Deux ou plus,,,,,,Électrique ou hybride,Électrique ou hybride,Mes véhicules consomment ... Litres aux 100 km :,11,18000,Le progrès technique permettra de trouver des solutions pour empêcher le changement climatique,,,"Il n’y a rien à faire, le changement climatique est inévitable",mondiales,Pas du tout souhaitable,Pas du tout souhaitable,Pas vraiment souhaitable,Pas vraiment souhaitable,Pas du tout souhaitable,Pas vraiment souhaitable,Non,7,6,2,5,3,1,4,,Un peu,Uniquement à des processus naturels,,Le changement climatique aura des effets positifs pour l'agriculture et les loisirs,,,,,,,Des causes naturelles,"Oui, certainement",Presque jamais,9,Beaucoup moins,L'obligation de rénovation thermique des logements les moins bien isolés assortie d'aides de l'État,Des normes plus strictes sur l'isolation pour les nouveaux bâtiments,,,,"Non, je ne suis pas favorable à une augmentation de la taxe carbone",,On peut faire confiance à la plupart des gens,l’indépendance,,,l’assiduité au travail,,l’obéissance,la responsabilité,,l’expression personnelle,,,0,Assez souvent,1,1,9,Oui,Pas du tout confiance,Non,"Oui, je sais très bien ce que c'est","Des individus manipulés ",Aucune mesure n'a été révélée à ma connaissance,Inutile car le gouvernement ne reprend que les mesures qui lui plaisent,,,,,,,,,,,,Non,,,,,Ils sont plus pro-gouvernement,,,,,,,,,0,0,3.971,0,"Oui, j'ai consacré toute mon attention aux questions jusqu'à présent et je pense que vous devriez utiliser mes réponses pour votre étude",,,,,,"Oui, tout à fait","Non, pas du tout","Non, pas vraiment","Non, pas du tout","Non, pas du tout","Non, pas du tout",Indifférent·e ou ne sais pas,"Non, pas du tout",Oui,Non,Non,Non,Non,Oui,Non,Non,Non,,,,,,3.935,62.579,63.589,15,Mon ménage perdrait environ (en € par an) :,,500,Je suis moyennement sûr·e de ma réponse,Non,"NSP (Ne sais pas, ne se prononce pas)",3.239,13.785,14.86,7,Perdant,Je suis sûr·e de ma réponse,Non,Beaucoup,Jamais,,,,De droite,,,,,,,,,Je les soutiens,,,,Pas du tout favorable,Les Républicains,ce parti représente les gens comme moi,9,9,2,1,10,3,5,3,10,0,10,,,160959271641149,1072,,2,SO,1,0,2,330.001524000000017622369341552257537841796875,11,134.991323999999991656295605935156345367431640625,0,195.01019999999999754436430521309375762939453125,18000,1,2,0,EELV,0
2020-10-19 12:30:55,2020-10-19 12:48:04,IP Address,92.136.243.112,100,1028,True,2020-10-19 12:48:04,R_xmuoNmdgBtFe0I9,,,,,43.6436004638671875,-0.7360992431640625,anonymous,FR,40180,Masculin,65 ans ou plus,retraité·e,Retraité·e,"Bac +2 (BTS, DUT, DEUG, écoles de formation sanitaires et sociales...)",1,2300,2300,1,1,Locataire,,,,Entre 10 001€ et 60 000€,100,Électricité,La voiture,La voiture,La voiture,Un,,Essence,Mon véhicule consomme ... Litres aux 100 km :,5,10000,,,,,,,Il faudra modifier de façon importante nos modes de vie pour empêcher le changement climatique,,,européennes,Assez souhaitable,Assez souhaitable,Assez souhaitable,Assez souhaitable,Pas vraiment souhaitable,Assez souhaitable,Oui,2,4,3,1,6,5,8,7,Un peu,,est principalement dû à la variabilité naturelle du climat,,"Graves, car il y aurait plus de catastrophes naturelles",,,,,Les générations passées,Des causes naturelles,"Non, probablement pas",Presque jamais,51,Autant,,,Un renforcement du bonus/malus écologique pour l’achat d’un véhicule,,,"Non, je ne suis pas favorable à une augmentation de la taxe carbone",,On n’est jamais assez prudent quand on a affaire aux autres,,la tolérance et le respect des autres,,,,l’obéissance,,la détermination et la persévérance,,,,5,Assez souvent,6,8,7,Oui,Plutôt pas confiance,Oui,"Non, je n'en ai jamais entendu parler",,,,,,,,,,,,,,,,,,,,,,,,,,,,,0,0,6.465,0,"Oui, j'ai consacré toute mon attention aux questions jusqu'à présent et je pense que vous devriez utiliser mes réponses pour votre étude",,,,,,"Oui, plutôt","Non, pas du tout",Indifférent·e ou ne sais pas,"Non, pas vraiment","Non, pas du tout","Non, pas vraiment","Oui, plutôt","Oui, plutôt",Oui,Oui,"Abstention, blanc ou nul","Abstention, blanc ou nul",Non,Oui,"Abstention, blanc ou nul","Abstention, blanc ou nul","Abstention, blanc ou nul",,,,,,67.768,86.585,89.212,4,Mon ménage ne serait pas affecté financièrement (gain de 0€ par an),,,Je suis moyennement sûr·e de ma réponse,"NSP (Ne sais pas, ne se prononce pas)",Cette estimation semble correcte,29.231,38.696,40.595,4,Non affecté,Je suis moyennement sûr·e de ma réponse,"NSP (Ne sais pas, ne se prononce pas)",Un peu,Parfois,,De gauche,,,,,,,,,,,,,Je m'y oppose,,Assez favorable,Parti socialiste,ce parti affiche des positions proches des miennes,7,6,5,4,2,3,4,6,4,7,7,RAS,,160959274681422,1028,,3,SO,0,0,1,49.24499999999999744204615126363933086395263671875,5,0,0,49.24499999999999744204615126363933086395263671875,10000,1,1,1,EELV,170
2020-10-19 12:34:45,2020-10-19 12:49:34,IP Address,78.243.35.181,100,888,True,2020-10-19 12:49:34,R_z7Ex05MgmemujNn,,,,,49.3040924072265625,6.1045989990234375,anonymous,FR,57190,Masculin,50 à 64 ans,inactif/ve,Autre Inactif/ve,"Bac +2 (BTS, DUT, DEUG, écoles de formation sanitaires et sociales...)",1,900,900,1,1,Locataire,,,,NSP (Ne souhaite pas répondre),60,Gaz de ville,Non concerné·e,Non concerné·e,Non concerné·e,Aucun,0,,,,,,,,,,,Il faudra modifier de façon importante nos modes de vie pour empêcher le changement climatique,,,mondiales,Pas vraiment souhaitable,Assez souhaitable,Assez souhaitable,Assez souhaitable,Assez souhaitable,Assez souhaitable,Oui,1,5,3,2,7,8,6,,Un peu,Uniquement à l'activité humaine,,,"Désastreux, les modes de vie seraient largement altérés",Chacun d'entre nous,,Les gouvernements,,,,"Non, probablement pas",Plusieurs fois par mois,39,Autant,L'obligation de rénovation thermique des logements les moins bien isolés assortie d'aides de l'État,Des normes plus strictes sur l'isolation pour les nouveaux bâtiments,,,"Non, je ne suis pas favorable à une augmentation de la taxe carbone",,,On n’est jamais assez prudent quand on a affaire aux autres,,la tolérance et le respect des autres,la générosité,,,l’obéissance,la responsabilité,la détermination et la persévérance,,,,5,Assez souvent,8,9,9,Oui,Plutôt pas confiance,Oui,"Oui, je sais assez bien ce que c'est",<<<<<<<<<<<<<<<<<<<<<<<<<<<<<<<<<<<<<<<<<<<<<<<<<<<<<<<<<<<<<<<<<<<<<<<<<<<<,"Oui, les mesures ont déjà été rendues publiques",,,Un espoir pour le renouveau des institutions,,Une opération de communication du gouvernement,,Une façon pour le gouvernement de se défausser de ses responsabilités,Une opportunité pour faire entendre la voix de l’ensemble des Français,,,,,Non,,,Ils sont plus écologistes,,,Ils sont moins pro-gouvernement,,,,,,,,,,,,,13.395,13.395,15.723,1,"Oui, j'ai consacré toute mon attention aux questions jusqu'à présent et je pense que vous devriez utiliser mes réponses pour votre étude","Oui, tout à fait",Indifférent·e ou ne sais pas,"Oui, plutôt","Oui, plutôt",Indifférent·e ou ne sais pas,Indifférent·e ou ne sais pas,Indifférent·e ou ne sais pas,Indifférent·e ou ne sais pas,"Abstention, blanc ou nul","Abstention, blanc ou nul",Oui,Oui,Oui,"Abstention, blanc ou nul","Abstention, blanc ou nul",Non,Non,"Oui, il me semble","Oui, j'en suis sûr·e","Non, ça ne me dit rien","Non, ça ne me dit rien","Oui, il me semble",14.629,33.913,35.279,4,Mon ménage ne serait pas affecté financièrement (gain de 0€ par an),,,Je ne suis pas du tout sûr·e de ma réponse,Non,Ce chiffre semble trop élevé par rapport à la réalité,7.625,22.822,24.22,3,Non affecté,Je suis moyennement sûr·e de ma réponse,"NSP (Ne sais pas, ne se prononce pas)",Un peu,Parfois,,,,,,,,,,Apolitique,,,,,Je m'y oppose,,Assez favorable,La République En Marche,ce parti répond aux questions qui me semblent les plus importantes,3,6,6,3,4,7,4,3,7,7,4,,,160959270161474,888,,4,Est,1,0,0,89.99421599999999443753040395677089691162109375,7,89.99421599999999443753040395677089691162109375,0,0,0,0,3,0,gouvernement,170
