StartDate,EndDate,Status,IPAddress,Progress,Duration (in seconds),Finished,RecordedDate,ResponseId,RecipientLastName,RecipientFirstName,RecipientEmail,ExternalReference,LocationLatitude,LocationLongitude,DistributionChannel,UserLanguage,Q93,Q96,Q184,Q35,Q98,Q102,Q29,Q148,Q25,Q84,Q125,Q127_1,Q127_2,Q127_3,Q127_4,Q129,Q175,Q36,Q39_1,Q39_2,Q39_3,Q37,Q142,Q77,Q174,Q174_4_TEXT,Q38,Q100,Q101,Q176,Q176_4_TEXT,Q141,Q50_1,Q50_2,Q50_3,Q50_4,Q51,Q74_1,Q74_2,Q74_3,Q74_4,Q74_5,Q74_6,Q54,Q55_1,Q55_2,Q55_3,Q55_4,Q55_5,Q55_6,Q55_7,Q55_8,Q177,Q56,Q1,Q57,Q5,Q6_1,Q6_2,Q6_3,Q6_4,Q6_5,Q6_6,Q58,Q60,Q61_1,Q62,Q63_1,Q63_4,Q63_2,Q63_3,Q64,Q92,Q104,Q65,Q70_1,Q70_2,Q70_3,Q70_4,Q70_5,Q70_6,Q70_7,Q70_8,Q70_9,Q70_10,Q70_11,Q69_1,Q71,Q68_1,Q68_2,Q68_3,Q105,Q73,Q77,Q76,Q78,Q95,Q79_9,Q79_1,Q79_2,Q79_3,Q79_4,Q79_5,Q79_6,Q79_7,Q79_8,Q79_11,Q79_10,Q79_10_TEXT,Q113,Q114_1,Q114_2,Q114_3,Q114_4,Q114_5,Q114_6,Q114_7,Q114_7_TEXT,Q96_1,Q96_2,Q96_3,Q96_4,Q96_5,Q102_First Click,Q102_Last Click,Q102_Page Submit,Q102_Click Count,Q89,Q103_First Click,Q103_Last Click,Q103_Page Submit,Q103_Click Count,Q90,Q86_1,Q86_2,Q86_3,Q86_4,Q86_5,Q86_6,Q86_7,Q86_8,Q87_1,Q87_2,Q87_3,Q87_4,Q87_5,Q87_6,Q87_7,Q87_8,Q87_9,Q98_1,Q98_2,Q98_3,Q98_4,Q98_5,Q98_First Click,Q98_Last Click,Q98_Page Submit,Q98_Click Count,Q166,Q166_5_TEXT,Q166_1_TEXT,Q78,Q15,Q97,Q99_First Click,Q99_Last Click,Q99_Page Submit,Q99_Click Count,Q63,Q79,Q64,Q32,Q93,Q34_1,Q34_2,Q34_3,Q34_4,Q34_5,Q34_6,Q34_7,Q34_8,Q34_9,Q34_10,Q34_11,Q35_1,Q35_2,Q35_3,Q35_4,Q35_5,Q118,Q117,Q108,Q109_1,Q109_2,Q109_3,Q109_4,Q109_5,Q110_1,Q110_2,Q110_3,Q110_4,Q110_5,Q115_1,Q99,Q91,ID,Q_TotalDuration,Q_TerminateFlag,PERSO1,region,gas,fuel,nb_vehicles,energy_expenditures_increase,conso,heating_increase,diesel_increase,gasoline_increase,km,info_ccc,random,variante_vous,origine_taxe,dividende
Start Date,End Date,Response Type,IP Address,Progress,Duration (in seconds),Finished,Recorded Date,Response ID,Recipient Last Name,Recipient First Name,Recipient Email,External Data Reference,Location Latitude,Location Longitude,Distribution Channel,User Language,Quel est votre code postal ?,Quel est votre sexe (au sens de l'Etat civil) ?,Quelle est votre tranche d'âge ?,Quel est votre statut d'emploi ?,Quelle est votre catégorie socio-professionnelle ? (Les chômeurs/ses doivent indiquer leur ancienne profession).,Quel est votre plus haut diplôme ?,"Combien de personnes composent votre ménage ? Le ménage inclut : vous, les membres de votre famille qui vivent avec vous, et les personnes à votre charge.","Quel est votre revenu personnel mensuel net (avant impôt sur le revenu, en euros) ? Sont inclus ici tous les revenus : salaires, pensions, allocations, APL, revenus fonciers, etc. Nous rappelons que le sondage est anonyme.","Quel est le revenu mensuel net de votre ménage (avant impôt sur le revenu, en euros) ? Sont inclus ici tous les revenus : salaires, pensions, allocations, APL, revenus fonciers, etc.",Dans votre ménage combien de personnes ont 14 ans ou plus (vous inclus) ?,"Dans votre ménage, combien de personnes sont majeures (vous inclus) ?",Êtes-vous propriétaire ou locataire ? (Plusieurs réponses possibles) - Locataire,Êtes-vous propriétaire ou locataire ? (Plusieurs réponses possibles) - Propriétaire occupant,Êtes-vous propriétaire ou locataire ? (Plusieurs réponses possibles) - Propriétaire bailleur,Êtes-vous propriétaire ou locataire ? (Plusieurs réponses possibles) - Hébergé gratuitement,"À combien estimez-vous votre patrimoine, ou celui de votre ménage si vous êtes marié·e ou pacsé·e (en euros) ? Sont incluses ici toutes vos possessions (logement, voiture, épargne, etc.) nettes de dette. Par exemple, si vous possédez une maison valant 250 000€, votre seul bien, et qu'il vous reste 100 000€ à rembourser sur votre crédit immobilier, votre patrimoine s'élève à 150 000€.",Quelle est la surface de votre logement ? (en m²),Quelle est la source d'énergie de chauffage principale de votre logement ?,Quel mode de transports avez-vous principalement utilisé pour chacun des trajets suivants en 2019 ? - Domicile - travail (ou études),Quel mode de transports avez-vous principalement utilisé pour chacun des trajets suivants en 2019 ? - Faire les courses,Quel mode de transports avez-vous principalement utilisé pour chacun des trajets suivants en 2019 ? - Loisirs (hors vacances),De combien de véhicules motorisés votre ménage dispose-t-il ?,Combien de kilomètres avez-vous parcouru en voiture ou moto en 2019 ?,Quel type de carburant utilisez-vous pour ce véhicule ?,Quelle est la consommation moyenne de votre véhicule ? (en Litres aux 100 km) - Selected Choice,Quelle est la consommation moyenne de votre véhicule ? (en Litres aux 100 km) - Mon véhicule consomme ... Litres aux 100 km : - Texte,Combien de kilomètres ont été parcourus avec votre véhicule en 2019 ?,Quel type de carburant utilisez-vous pour votre véhicule principal ?,Quel type de carburant utilisez-vous pour votre deuxième véhicule ?,Quelle est la consommation moyenne de l'ensemble de vos véhicules ? (en Litres aux 100 km) - Selected Choice,Quelle est la consommation moyenne de l'ensemble de vos véhicules ? (en Litres aux 100 km) - Mes véhicules consomment ... Litres aux 100 km : - Texte,Combien de kilomètres ont été parcourus avec l'ensemble de vos véhicules en 2019 ?,"De ces quatre opinions, laquelle se rapproche le plus de la vôtre ? (cocher une SEULE case) - Le progrès technique permettra de trouver des solutions pour empêcher le changement climatique","De ces quatre opinions, laquelle se rapproche le plus de la vôtre ? (cocher une SEULE case) - Il faudra modifier de façon importante nos modes de vie pour empêcher le changement climatique","De ces quatre opinions, laquelle se rapproche le plus de la vôtre ? (cocher une SEULE case) - C’est aux États de réglementer, au niveau mondial, le changement climatique","De ces quatre opinions, laquelle se rapproche le plus de la vôtre ? (cocher une SEULE case) - Il n’y a rien à faire, le changement climatique est inévitable",Pensez-vous que le changement climatique exige d’être pris en charge par des politiques publiques ...,"Pour chacune des mesures que l’on pourrait adopter pour limiter les émissions de gaz à effet de serre, dites si elle vous paraît ou non souhaitable : - Augmenter le prix des produits de consommation qui sont acheminés par des modes de transport polluants","Pour chacune des mesures que l’on pourrait adopter pour limiter les émissions de gaz à effet de serre, dites si elle vous paraît ou non souhaitable : - Développer les énergies renouvelables même si, dans certains cas, les coûts de production sont plus élevés, pour le moment","Pour chacune des mesures que l’on pourrait adopter pour limiter les émissions de gaz à effet de serre, dites si elle vous paraît ou non souhaitable : - Densifier les villes en limitant l’habitat pavillonnaire au profit d’immeubles collectifs","Pour chacune des mesures que l’on pourrait adopter pour limiter les émissions de gaz à effet de serre, dites si elle vous paraît ou non souhaitable : - Favoriser l’usage (voies de circulation, place de stationnement réservées) des véhicules peu polluants ou partagés (covoiturage)","Pour chacune des mesures que l’on pourrait adopter pour limiter les émissions de gaz à effet de serre, dites si elle vous paraît ou non souhaitable : - Obliger la restauration collective publique à proposer une offre de menu végétarien, biologique et/ou de saison","Pour chacune des mesures que l’on pourrait adopter pour limiter les émissions de gaz à effet de serre, dites si elle vous paraît ou non souhaitable : - Réduire le gaspillage alimentaire de moitié",Pensez-vous que la France doit prendre de l’avance sur d’autres pays dans la lutte contre le changement climatique ?,Quels sont pour vous les obstacles à la lutte contre de le changement climatique ? Classer les obstacles suivants (1 = le principal obstacle ; 7 = le moins important ) - Les lobbies,Quels sont pour vous les obstacles à la lutte contre de le changement climatique ? Classer les obstacles suivants (1 = le principal obstacle ; 7 = le moins important ) - Le manque de volonté politique,Quels sont pour vous les obstacles à la lutte contre de le changement climatique ? Classer les obstacles suivants (1 = le principal obstacle ; 7 = le moins important ) - Le manque de coopération entre pays,Quels sont pour vous les obstacles à la lutte contre de le changement climatique ? Classer les obstacles suivants (1 = le principal obstacle ; 7 = le moins important ) - Les inégalités,Quels sont pour vous les obstacles à la lutte contre de le changement climatique ? Classer les obstacles suivants (1 = le principal obstacle ; 7 = le moins important ) - Les incertitudes de la communauté scientifique,Quels sont pour vous les obstacles à la lutte contre de le changement climatique ? Classer les obstacles suivants (1 = le principal obstacle ; 7 = le moins important ) - La démographie,Quels sont pour vous les obstacles à la lutte contre de le changement climatique ? Classer les obstacles suivants (1 = le principal obstacle ; 7 = le moins important ) - Le manque de technologies alternatives,Quels sont pour vous les obstacles à la lutte contre de le changement climatique ? Classer les obstacles suivants (1 = le principal obstacle ; 7 = le moins important ) - Rien de tout cela,Merci de sélectionner 'Un peu' (test pour vérifier que vous êtes attentif/ve).,Pensez-vous que le changement climatique est dû à ...,"Selon vous, le changement climatique ...","Si le changement climatique continue, à votre avis, quelles seront les conséquences en France d'ici une cinquantaine d'années ?","Selon vous, comment seraient les effets du changement climatique, dans l'hypothèse où l'humanité ne ferait rien pour le limiter ?","Selon vous, qui est responsable du changement climatique ? (Plusieurs choix possibles) - Chacun d'entre nous","Selon vous, qui est responsable du changement climatique ? (Plusieurs choix possibles) - Les plus riches","Selon vous, qui est responsable du changement climatique ? (Plusieurs choix possibles) - Les gouvernements","Selon vous, qui est responsable du changement climatique ? (Plusieurs choix possibles) - Certains pays étrangers","Selon vous, qui est responsable du changement climatique ? (Plusieurs choix possibles) - Les générations passées","Selon vous, qui est responsable du changement climatique ? (Plusieurs choix possibles) - Des causes naturelles",Pensez-vous que le changement climatique sera limité à un niveau acceptable d’ici la fin du siècle ?,À quelle fréquence parlez-vous du changement climatique ?,"À votre avis, quelle est la part des Français qui estiment que le changement climatique est principalement dû à l'activité humaine ? - %","Estimez-vous que la majorité des Français soit prête à faire plus, ou moins d'efforts que vous pour lutter contre le changement climatique ?","Parmi les politiques suivantes, selon vous, lesquelles sont soutenues par une majorité des Français ? - L'obligation de rénovation thermique des logements les moins bien isolés assortie d'aides de l'État","Parmi les politiques suivantes, selon vous, lesquelles sont soutenues par une majorité des Français ? - Des normes plus strictes sur l'isolation pour les nouveaux bâtiments","Parmi les politiques suivantes, selon vous, lesquelles sont soutenues par une majorité des Français ? - Un renforcement du bonus/malus écologique pour l’achat d’un véhicule","Parmi les politiques suivantes, selon vous, lesquelles sont soutenues par une majorité des Français ? - L'abaissement de la limitation de vitesse sur les autoroutes à 110 km/h","Dans un sondage de 2019, une majorité de Français se sont exprimés contre une augmentation de la taxe carbone comme moyen de lutte contre le changement climatique (Source: ADEME, p. 21). 
Vous-mêmes, êtes-vous favorable à une telle mesure ?","Dans un sondage de 2018, une majorité de Français se sont exprimés en faveur d'une augmentation de la taxe carbone comme moyen de lutte contre le changement climatique (Source: ADEME, p. 17). 
Vous-mêmes, êtes-vous favorable à une telle mesure ?",Êtes-vous favorable à une augmentation de la taxe carbone comme moyen de lutte contre le changement climatique ?,"D’une manière générale, diriez-vous que… ?","Voici une liste de qualités qu’on encourage souvent chez les enfants. D’après-vous, lesquelles sont les plus importantes ? (Cocher au plus cinq cases) - l’indépendance","Voici une liste de qualités qu’on encourage souvent chez les enfants. D’après-vous, lesquelles sont les plus importantes ? (Cocher au plus cinq cases) - la tolérance et le respect des autres","Voici une liste de qualités qu’on encourage souvent chez les enfants. D’après-vous, lesquelles sont les plus importantes ? (Cocher au plus cinq cases) - la générosité","Voici une liste de qualités qu’on encourage souvent chez les enfants. D’après-vous, lesquelles sont les plus importantes ? (Cocher au plus cinq cases) - l’assiduité au travail","Voici une liste de qualités qu’on encourage souvent chez les enfants. D’après-vous, lesquelles sont les plus importantes ? (Cocher au plus cinq cases) - le sens de l’épargne","Voici une liste de qualités qu’on encourage souvent chez les enfants. D’après-vous, lesquelles sont les plus importantes ? (Cocher au plus cinq cases) - l’obéissance","Voici une liste de qualités qu’on encourage souvent chez les enfants. D’après-vous, lesquelles sont les plus importantes ? (Cocher au plus cinq cases) - la responsabilité","Voici une liste de qualités qu’on encourage souvent chez les enfants. D’après-vous, lesquelles sont les plus importantes ? (Cocher au plus cinq cases) - la détermination et la persévérance","Voici une liste de qualités qu’on encourage souvent chez les enfants. D’après-vous, lesquelles sont les plus importantes ? (Cocher au plus cinq cases) - l’expression personnelle","Voici une liste de qualités qu’on encourage souvent chez les enfants. D’après-vous, lesquelles sont les plus importantes ? (Cocher au plus cinq cases) - l’imagination","Voici une liste de qualités qu’on encourage souvent chez les enfants. D’après-vous, lesquelles sont les plus importantes ? (Cocher au plus cinq cases) - la foi religieuse","Que pensez-vous de l’affirmation suivante : « Pour établir la justice sociale, il faudrait prendre aux riches pour donner aux pauvres » ? - 1",Avez-vous le sentiment d’être confronté·e personnellement à des difficultés importantes que les pouvoirs publics ou les médias ne voient pas vraiment ?,"Pour chacune des choses suivantes, dites combien elle est importante pour vous : - La protection de l’environnement","Pour chacune des choses suivantes, dites combien elle est importante pour vous : - L’action sociale et associative","Pour chacune des choses suivantes, dites combien elle est importante pour vous : - L’amélioration de mon niveau de vie et de confort",Paie-t-on trop d'impôt en France ?,Quel est votre niveau de confiance dans la capacité de citoyens tirés au sort à délibérer de manière productive sur des questions politiques complexes ?,"Seriez-vous favorable à une réforme constitutionnelle qui introduirait une assemblée constituée de 150 citoyens tirés au sort, et qui doterait cette assemblée d'un droit de veto sur les textes de lois votés au Parlement ?",Avez-vous entendu parler de la Convention Citoyenne pour le Climat ?,Décrivez ce que vous savez de la Convention Citoyenne pour le Climat.,Savez-vous si les mesures proposées par la Convention Citoyenne pour le Climat ont déjà été rendues publiques ?,Pensez-vous que la Convention Citoyenne pour le Climat est … ? (plusieurs choix possibles) - Selected Choice - Inutile car le gouvernement ne reprend que les mesures qui lui plaisent,Pensez-vous que la Convention Citoyenne pour le Climat est … ? (plusieurs choix possibles) - Selected Choice - Une méthode prometteuse pour définir la politique climatique de la France,Pensez-vous que la Convention Citoyenne pour le Climat est … ? (plusieurs choix possibles) - Selected Choice - Un espoir pour le renouveau des institutions,Pensez-vous que la Convention Citoyenne pour le Climat est … ? (plusieurs choix possibles) - Selected Choice - Une expérience vouée à l’échec depuis le début,Pensez-vous que la Convention Citoyenne pour le Climat est … ? (plusieurs choix possibles) - Selected Choice - Une opération de communication du gouvernement,Pensez-vous que la Convention Citoyenne pour le Climat est … ? (plusieurs choix possibles) - Selected Choice - Une initiative sincère du gouvernement en faveur de la démocratie,Pensez-vous que la Convention Citoyenne pour le Climat est … ? (plusieurs choix possibles) - Selected Choice - Une façon pour le gouvernement de se défausser de ses responsabilités,Pensez-vous que la Convention Citoyenne pour le Climat est … ? (plusieurs choix possibles) - Selected Choice - Une opportunité pour faire entendre la voix de l’ensemble des Français,Pensez-vous que la Convention Citoyenne pour le Climat est … ? (plusieurs choix possibles) - Selected Choice - Une assemblée manipulée ou contrôlée par le gouvernement,Pensez-vous que la Convention Citoyenne pour le Climat est … ? (plusieurs choix possibles) - Selected Choice - Une assemblée représentative de la population,Pensez-vous que la Convention Citoyenne pour le Climat est … ? (plusieurs choix possibles) - Selected Choice - Autre :,Pensez-vous que la Convention Citoyenne pour le Climat est … ? (plusieurs choix possibles) - Autre : - Texte,Pensez-vous que les citoyens membres de la Convention Citoyenne pour le Climat sont représentatifs de l'ensemble des Français ?,En quoi selon-vous ces citoyens diffèrent-ils de la moyenne des Français ? (Plusieurs réponses possibles.) - Selected Choice - Ils sont plus à gauche politiquement,En quoi selon-vous ces citoyens diffèrent-ils de la moyenne des Français ? (Plusieurs réponses possibles.) - Selected Choice - Ils sont plus à droite politiquement,En quoi selon-vous ces citoyens diffèrent-ils de la moyenne des Français ? (Plusieurs réponses possibles.) - Selected Choice - Ils sont plus écologistes,En quoi selon-vous ces citoyens diffèrent-ils de la moyenne des Français ? (Plusieurs réponses possibles.) - Selected Choice - Ils sont moins écologistes,En quoi selon-vous ces citoyens diffèrent-ils de la moyenne des Français ? (Plusieurs réponses possibles.) - Selected Choice - Ils sont plus pro-gouvernement,En quoi selon-vous ces citoyens diffèrent-ils de la moyenne des Français ? (Plusieurs réponses possibles.) - Selected Choice - Ils sont moins pro-gouvernement,En quoi selon-vous ces citoyens diffèrent-ils de la moyenne des Français ? (Plusieurs réponses possibles.) - Selected Choice - Autre,En quoi selon-vous ces citoyens diffèrent-ils de la moyenne des Français ? (Plusieurs réponses possibles.) - Autre - Texte,Vous pensez que les propositions de la Convention Citoyenne pour le Climat ont déjà été rendues publiques. Savez-vous si les mesures suivantes font partie des mesures proposées ? - Une contribution à un fonds mondial pour le climat,Vous pensez que les propositions de la Convention Citoyenne pour le Climat ont déjà été rendues publiques. Savez-vous si les mesures suivantes font partie des mesures proposées ? - L'obligation de rénovation thermique des logements les moins bien isolés assortie d'aides de l'État,Vous pensez que les propositions de la Convention Citoyenne pour le Climat ont déjà été rendues publiques. Savez-vous si les mesures suivantes font partie des mesures proposées ? - Une taxe sur la viande rouge,Vous pensez que les propositions de la Convention Citoyenne pour le Climat ont déjà été rendues publiques. Savez-vous si les mesures suivantes font partie des mesures proposées ? - L'abaissement de la limitation de vitesse sur les autoroutes à 110 km/h,Vous pensez que les propositions de la Convention Citoyenne pour le Climat ont déjà été rendues publiques. Savez-vous si les mesures suivantes font partie des mesures proposées ? - La réduction du temps de travail légal à 28 heures par semaine,Timing - Premier clic,Timing - Dernier clic,Timing - Envoi de page,Timing - Cliquer sur le décompte,"Avant de passer à la prochaine série de questions, nous souhaitons avoir votre avis sur les réponses que vous avez fournies jusqu'à présent. Il est essentiel pour notre étude de n'inclure que les réponses des personnes qui ont consacré toute leur attention au questionnaire. Cela n'affectera en rien le paiement que vous recevrez pour avoir participé à cette enquête. 
À votre avis, devrions-nous utiliser vos réponses, ou devrions-nous les écarter car vous n'avez pas consacré toute votre attention aux questions jusqu'à présent ?",Timing - Premier clic,Timing - Dernier clic,Timing - Envoi de page,Timing - Cliquer sur le décompte,"Avant de passer à la prochaine série de questions, nous souhaitons avoir votre avis sur les réponses que vous avez fournies jusqu'à présent. Il est essentiel pour notre étude de n'inclure que les réponses des personnes qui ont consacré toute leur attention au questionnaire. Cela n'affectera en rien le paiement que vous recevrez pour avoir participé à cette enquête. 
À votre avis, devrions-nous utiliser vos réponses, ou devrions-nous les écarter car vous n'avez pas consacré toute votre attention aux questions jusqu'à présent ?",[La Convention Citoyenne pour le Climat a proposé plusieurs mesures politiques. : affiché seulement aux répondants ayant eu l’info CCC] Seriez-vous favorable aux politiques environnementales suivantes ? - L'obligation de rénovation thermique des logements les moins bien isolés assortie d'aides de l'État,[La Convention Citoyenne pour le Climat a proposé plusieurs mesures politiques. : affiché seulement aux répondants ayant eu l’info CCC] Seriez-vous favorable aux politiques environnementales suivantes ? - L'abaissement de la limitation de vitesse sur les autoroutes à 110 km/h,[La Convention Citoyenne pour le Climat a proposé plusieurs mesures politiques. : affiché seulement aux répondants ayant eu l’info CCC] Seriez-vous favorable aux politiques environnementales suivantes ? - L'interdiction des véhicules les plus polluants dans les centre-villes,[La Convention Citoyenne pour le Climat a proposé plusieurs mesures politiques. : affiché seulement aux répondants ayant eu l’info CCC] Seriez-vous favorable aux politiques environnementales suivantes ? - Le conditionnement des aides à l'innovation versées aux entreprises à la baisse de leur bilan carbone,[La Convention Citoyenne pour le Climat a proposé plusieurs mesures politiques. : affiché seulement aux répondants ayant eu l’info CCC] Seriez-vous favorable aux politiques environnementales suivantes ? - Une taxe sur la viande rouge,[La Convention Citoyenne pour le Climat a proposé plusieurs mesures politiques. : affiché seulement aux répondants ayant eu l’info CCC] Seriez-vous favorable aux politiques environnementales suivantes ? - Une contribution à un fonds mondial pour le climat,[La Convention Citoyenne pour le Climat a proposé plusieurs mesures politiques. : affiché seulement aux répondants ayant eu l’info CCC] Seriez-vous favorable aux politiques environnementales suivantes ? - Une baisse des prix des billets de train grâce à des aides de l'État,[La Convention Citoyenne pour le Climat a proposé plusieurs mesures politiques. : affiché seulement aux répondants ayant eu l’info CCC] Seriez-vous favorable aux politiques environnementales suivantes ? - Un renforcement du bonus/malus écologique pour l’achat d’un véhicule,"[Les membres de la Convention Citoyenne pour le Climat ont élaboré et proposé des mesures politiques, et ont débattu de l'opportunité de soumettre certaines de ces mesures à référendum. : affiché seulement aux répondants ayant eu l’info CCC] S’il y avait un référendum sur les mesures suivantes, que voteriez-vous pour chacune d’entre elles ? - La mise en place d'un système de consigne de verre et plastique d'ici 2025","[Les membres de la Convention Citoyenne pour le Climat ont élaboré et proposé des mesures politiques, et ont débattu de l'opportunité de soumettre certaines de ces mesures à référendum. : affiché seulement aux répondants ayant eu l’info CCC] S’il y avait un référendum sur les mesures suivantes, que voteriez-vous pour chacune d’entre elles ? - Une taxe de 4% sur les dividendes des entreprises versant plus de 10 millions d'euros de dividendes, pour financer la transition écologique","[Les membres de la Convention Citoyenne pour le Climat ont élaboré et proposé des mesures politiques, et ont débattu de l'opportunité de soumettre certaines de ces mesures à référendum. : affiché seulement aux répondants ayant eu l’info CCC] S’il y avait un référendum sur les mesures suivantes, que voteriez-vous pour chacune d’entre elles ? - L'interdiction dès 2025 de la vente des véhicules neufs les plus polluants","[Les membres de la Convention Citoyenne pour le Climat ont élaboré et proposé des mesures politiques, et ont débattu de l'opportunité de soumettre certaines de ces mesures à référendum. : affiché seulement aux répondants ayant eu l’info CCC] S’il y avait un référendum sur les mesures suivantes, que voteriez-vous pour chacune d’entre elles ? - L'interdiction de la publicité pour les produits les plus polluants","[Les membres de la Convention Citoyenne pour le Climat ont élaboré et proposé des mesures politiques, et ont débattu de l'opportunité de soumettre certaines de ces mesures à référendum. : affiché seulement aux répondants ayant eu l’info CCC] S’il y avait un référendum sur les mesures suivantes, que voteriez-vous pour chacune d’entre elles ? - La mise en place de chèque alimentaires pour les plus démunis à utiliser dans le bio ou les AMAP (=circuits courts)","[Les membres de la Convention Citoyenne pour le Climat ont élaboré et proposé des mesures politiques, et ont débattu de l'opportunité de soumettre certaines de ces mesures à référendum. : affiché seulement aux répondants ayant eu l’info CCC] S’il y avait un référendum sur les mesures suivantes, que voteriez-vous pour chacune d’entre elles ? - L'obligation de rénovation thermique des logements les moins bien isolés assortie d'aides de l'État","[Les membres de la Convention Citoyenne pour le Climat ont élaboré et proposé des mesures politiques, et ont débattu de l'opportunité de soumettre certaines de ces mesures à référendum. : affiché seulement aux répondants ayant eu l’info CCC] S’il y avait un référendum sur les mesures suivantes, que voteriez-vous pour chacune d’entre elles ? - La reconnaissance du crime d'«écocide»","[Les membres de la Convention Citoyenne pour le Climat ont élaboré et proposé des mesures politiques, et ont débattu de l'opportunité de soumettre certaines de ces mesures à référendum. : affiché seulement aux répondants ayant eu l’info CCC] S’il y avait un référendum sur les mesures suivantes, que voteriez-vous pour chacune d’entre elles ? - L'inscription dans la Constitution que la préservation de l'environnement passe avant tout","[Les membres de la Convention Citoyenne pour le Climat ont élaboré et proposé des mesures politiques, et ont débattu de l'opportunité de soumettre certaines de ces mesures à référendum. : affiché seulement aux répondants ayant eu l’info CCC] S’il y avait un référendum sur les mesures suivantes, que voteriez-vous pour chacune d’entre elles ? - L'inscription dans la Constitution de la préservation de la biodiversité, de l'environnement et de la lutte contre le dérèglement climatique",Vous pensez que les propositions de la Convention Citoyenne pour le Climat ont déjà été rendues publiques. Savez-vous si les mesures suivantes font partie des mesures proposées ? - Une contribution à un fonds mondial pour le climat,Vous pensez que les propositions de la Convention Citoyenne pour le Climat ont déjà été rendues publiques. Savez-vous si les mesures suivantes font partie des mesures proposées ? - L'obligation de rénovation thermique des logements les moins bien isolés assortie d'aides de l'État,Vous pensez que les propositions de la Convention Citoyenne pour le Climat ont déjà été rendues publiques. Savez-vous si les mesures suivantes font partie des mesures proposées ? - Une taxe sur la viande rouge,Vous pensez que les propositions de la Convention Citoyenne pour le Climat ont déjà été rendues publiques. Savez-vous si les mesures suivantes font partie des mesures proposées ? - L'abaissement de la limitation de vitesse sur les autoroutes à 110 km/h,Vous pensez que les propositions de la Convention Citoyenne pour le Climat ont déjà été rendues publiques. Savez-vous si les mesures suivantes font partie des mesures proposées ? - La réduction du temps de travail légal à 28 heures par semaine,Timing - Premier clic,Timing - Dernier clic,Timing - Envoi de page,Timing - Cliquer sur le décompte,"Suite à une telle réforme, à combien estimez-vous les gains ou les pertes financières nettes pour votre ménage (en € par an) ? - Selected Choice","Suite à une telle réforme, à combien estimez-vous les gains ou les pertes financières nettes pour votre ménage (en € par an) ? - Mon ménage gagnerait environ (en € par an) : - Texte","Suite à une telle réforme, à combien estimez-vous les gains ou les pertes financières nettes pour votre ménage (en € par an) ? - Mon ménage perdrait environ (en € par an) : - Texte",Quel est votre degré de certitude pour la question précédente ?,Approuveriez-vous une telle mesure ?,Que pensez-vous de notre estimation de [hausse taxe]€ par an pour l'augmentation de taxes payées lors des achats de combustibles de votre ménage ?,Timing - Premier clic,Timing - Dernier clic,Timing - Envoi de page,Timing - Cliquer sur le décompte,"Avec une telle mesure, vis-à-vis du pouvoir d'achat, pensez-vous que votre ménage serait :",Quel est votre degré de certitude pour la question précédente ?,"Au vu de cette estimation, approuveriez-vous une telle mesure ?",À quel point êtes-vous intéressé·e par la politique ?,"En général, faites-vous confiance au gouvernement pour prendre de bonnes décisions ?",Comment vous définiriez-vous ? (Plusieurs réponses possibles) - D'extrême gauche,Comment vous définiriez-vous ? (Plusieurs réponses possibles) - De gauche,Comment vous définiriez-vous ? (Plusieurs réponses possibles) - Du centre,Comment vous définiriez-vous ? (Plusieurs réponses possibles) - De droite,Comment vous définiriez-vous ? (Plusieurs réponses possibles) - D'extrême droite,Comment vous définiriez-vous ? (Plusieurs réponses possibles) - Conservateur,Comment vous définiriez-vous ? (Plusieurs réponses possibles) - Libéral,Comment vous définiriez-vous ? (Plusieurs réponses possibles) - Humaniste,Comment vous définiriez-vous ? (Plusieurs réponses possibles) - Patriote,Comment vous définiriez-vous ? (Plusieurs réponses possibles) - Apolitique,Comment vous définiriez-vous ? (Plusieurs réponses possibles) - Écologiste,Que pensez-vous des gilets jaunes ? (Plusieurs réponses possibles) - J'en fais partie,Que pensez-vous des gilets jaunes ? (Plusieurs réponses possibles) - Je les soutiens,Que pensez-vous des gilets jaunes ? (Plusieurs réponses possibles) - Je les comprends,Que pensez-vous des gilets jaunes ? (Plusieurs réponses possibles) - Je m'y oppose,"Que pensez-vous des gilets jaunes ? (Plusieurs réponses possibles) - NSP (Ne sais pas, ne se prononce pas)",Êtes-vous favorable à la réduction du temps de travail légal à 28 heures par semaine ?,"Sans penser seulement aux élections, veuillez indiquer de quel parti politique vous vos sentez le plus proche ou du moins le moins éloigné ?","Lorsque vous soutenez un parti
politique, c’est surtout parce que :","Sur une échelle allant de 0
(« pas du tout d’accord ») à 10 (« tout à fait d’accord »),
indiquez à quel point vous êtes d’accord avec chacune des affirmations
suivantes: Le rôle d'un député devrait être avant tout de...: - représenter ceux qui ont voté pour lui","Sur une échelle allant de 0
(« pas du tout d’accord ») à 10 (« tout à fait d’accord »),
indiquez à quel point vous êtes d’accord avec chacune des affirmations
suivantes: Le rôle d'un député devrait être avant tout de...: - représenter sa circonscription","Sur une échelle allant de 0
(« pas du tout d’accord ») à 10 (« tout à fait d’accord »),
indiquez à quel point vous êtes d’accord avec chacune des affirmations
suivantes: Le rôle d'un député devrait être avant tout de...: - représenter l'ensemble du pays","Sur une échelle allant de 0
(« pas du tout d’accord ») à 10 (« tout à fait d’accord »),
indiquez à quel point vous êtes d’accord avec chacune des affirmations
suivantes: Le rôle d'un député devrait être avant tout de...: - représenter son parti","Sur une échelle allant de 0
(« pas du tout d’accord ») à 10 (« tout à fait d’accord »),
indiquez à quel point vous êtes d’accord avec chacune des affirmations
suivantes: Le rôle d'un député devrait être avant tout de...: - suivre son propre jugement","Et en réalité ? D'après vous, la plupart des députés... - représentent ceux qui ont voté pour eux","Et en réalité ? D'après vous, la plupart des députés... - représentent leur circonscription","Et en réalité ? D'après vous, la plupart des députés... - représentent l'ensemble du pays","Et en réalité ? D'après vous, la plupart des députés... - représentent leurs partis","Et en réalité ? D'après vous, la plupart des députés... - suivent leur propre jugement","A la prochaine élection législative, est-il envisageable pour vous de voter contre un candidat de votre parti préféré parce que vous ne lui faites pas confiance en tant que personne. - ...voter contre mon parti","Le sondage touche à sa fin. Vous pouvez désormais inscrire toute remarque, commentaire ou suggestion dans le champ ci-dessous.","Si vous désirez recevoir les résultats de cette enquête ou participer à une enquête ultérieure (une fois que le gouvernement aura transcrit les mesures de la Convention Citoyenne pour le Climat en projet de loi), vous pouvez inscrire ci-dessous votre adresse mail. Nous ne vous enverrons que deux e-mails en tout.",ID,Q_TotalDuration,Q_TerminateFlag,PERSO1,region,gas,fuel,nb_vehicles,energy_expenditures_increase,conso,heating_increase,diesel_increase,gasoline_increase,km,info_ccc,random,variante_vous,origine_taxe,dividende
