2020-10-19 13:13:06,2020-10-19 13:36:49,IP Address,83.199.138.105,100,1423,True,2020-10-19 13:36:51,R_3hzM4ZP9UFeCAA0,,,,,48.8533935546875,2.3488006591796875,anonymous,FR,75012,Féminin,50 à 64 ans,CDI,Employé·e,"Bac +2 (BTS, DUT, DEUG, écoles de formation sanitaires et sociales...)",1,2055,2055,1,1,Locataire,,,,Moins de 10 000€,15,Autre,Les transports en commun,Les transports en commun,Les transports en commun,Aucun,500,,,,,,,,,,,Il faudra modifier de façon importante nos modes de vie pour empêcher le changement climatique,,,mondiales,Pas vraiment souhaitable,Assez souhaitable,Pas vraiment souhaitable,Assez souhaitable,Assez souhaitable,Très souhaitable,Ne se prononce pas,,,1,,,2,,,Un peu,,est principalement dû à l'activité humaine,,"Cataclysmiques, l'humanité disparaîtrait",Chacun d'entre nous,,,Certains pays étrangers,,,"Non, probablement pas",Plusieurs fois par an,60,Un peu plus,,,Un renforcement du bonus/malus écologique pour l’achat d’un véhicule,,,"Non, je ne suis pas favorable à une augmentation de la taxe carbone",,On n’est jamais assez prudent quand on a affaire aux autres,l’indépendance,,,l’assiduité au travail,,,la responsabilité,la détermination et la persévérance,,l’imagination,,6,Assez souvent,6,4,7,Ça dépend qui et quels impôts,Plutôt pas confiance,"NSP (Ne sais pas, ne se prononce pas)",J'en ai entendu parler mais je ne sais pas très bien ce que c'est,Nsp,Je crois avoir entendu parler de mesures de la Convention mais je ne suis pas sûr·e,,Une méthode prometteuse pour définir la politique climatique de la France,,,,,,,,,,,"NSP (Ne sais pas, ne se prononce pas)",,,,,,,,,"Non, ça ne me dit rien","Non, ça ne me dit rien","Non, ça ne me dit rien","Non, ça ne me dit rien","Non, je suis sûr·e que non",24.593,30.46,31.377,4,"Oui, j'ai consacré toute mon attention aux questions jusqu'à présent et je pense que vous devriez utiliser mes réponses pour votre étude",,,,,,"Oui, plutôt",Indifférent·e ou ne sais pas,"Oui, plutôt","Oui, plutôt","Oui, plutôt",Indifférent·e ou ne sais pas,"Oui, tout à fait","Oui, plutôt",Oui,"Abstention, blanc ou nul","Abstention, blanc ou nul","Abstention, blanc ou nul","Abstention, blanc ou nul",Oui,Oui,"Abstention, blanc ou nul",Oui,,,,,,11.382,94.472,95.74,31,Mon ménage ne serait pas affecté financièrement (gain de 0€ par an),,,Je suis moyennement sûr·e de ma réponse,Oui,Ce chiffre semble trop élevé par rapport à la réalité,6.28,75.596,76.634,22,Perdant,Je suis sûr·e de ma réponse,Non,Un peu,La moitié du temps,,,,,,,Libéral,Humaniste,Patriote,,,,,,Je m'y oppose,,Assez peu favorable,Aucun,ce parti répond aux questions qui me semblent les plus importantes,5,8,7,5,6,8,8,5,10,7,5,,,160959275940891,1423,,5,IDF,0,0,0,3.61076685000000008329834599862806499004364013671875,7,0,1.810862100000000030064484235481359064579010009765625,1.7999047499999998311892568381153978407382965087890625,500,1,3,0,EELV,0
2020-10-19 13:09:28,2020-10-19 13:37:22,IP Address,86.210.57.31,100,1673,True,2020-10-19 13:37:22,R_1JDgo9m9b2DnFmj,,,,,42.744903564453125,2.9192962646484375,anonymous,FR,11370,Masculin,65 ans ou plus,retraité·e,Retraité·e,"Bac +5 ou plus (master, école d'ingénieur ou de commerce, doctorat, médecine, maîtrise, DEA, DESS...)",2,4880,4800,2,2,,Propriétaire occupant,,,Plus de 550 001€,156,"Bois, solaire, géothermie, aérothermie (pompe à chaleur)",La voiture,La voiture,La voiture,Un,,Électrique ou hybride,Mon véhicule consomme ... Litres aux 100 km :,5,14000,,,,,,,,,"Il n’y a rien à faire, le changement climatique est inévitable",à toutes les échelles,Assez souhaitable,Pas vraiment souhaitable,Pas vraiment souhaitable,Assez souhaitable,Pas du tout souhaitable,Très souhaitable,Non,,,,,,,,,Un peu,Principalement à des processus naturels,,,"Faibles, car les humains sauraient vivre avec",,,,,,Des causes naturelles,"Non, probablement pas",Plusieurs fois par mois,71,Autant,L'obligation de rénovation thermique des logements les moins bien isolés assortie d'aides de l'État,,,,"Non, je ne suis pas favorable à une augmentation de la taxe carbone",,,On n’est jamais assez prudent quand on a affaire aux autres,,la tolérance et le respect des autres,,l’assiduité au travail,le sens de l’épargne,,la responsabilité,,,l’imagination,,3,Assez souvent,8,5,5,Oui,Plutôt pas confiance,Non,"Oui, je sais très bien ce que c'est","150 personnes qui n'ont pas été tirés réellement au sort et qui nous ont fait des propositions dangereuses  voire des inepties à cause d'une confusion permanente entre réchauffement climatique et pollution notre terre bouge sans que l'homme y soit pour quelque chose par exemple la variation de position du nord magnétique et le mouvements des plaques tectoniques l'Afrique se rapproche de l'Europe à la vitesse de 2,5cm par an dans 600 000 ans plus de Méditerranée et ce n'est pas à cause des véhicule diesel...","Oui, les mesures ont déjà été rendues publiques",,,,,Une opération de communication du gouvernement,,Une façon pour le gouvernement de se défausser de ses responsabilités,,Une assemblée manipulée ou contrôlée par le gouvernement,,,,Non,Ils sont plus à gauche politiquement,,Ils sont plus écologistes,,,,Autre,ils ont été choisi pour leur position passées,"Oui, il me semble","Oui, il me semble","Non, ça ne me dit rien","Oui, j'en suis sûr·e","Oui, il me semble",0,0,4.811,0,"Oui, j'ai consacré toute mon attention aux questions jusqu'à présent et je pense que vous devriez utiliser mes réponses pour votre étude",,,,,,"Oui, tout à fait","Non, pas du tout","Oui, plutôt","Oui, plutôt","Non, pas vraiment","Non, pas vraiment","Oui, plutôt","Oui, plutôt",Oui,Non,Non,Non,Oui,Oui,Non,Non,Non,,,,,,85.242,161.338,163.877,6,Mon ménage gagnerait environ (en € par an) :,150,,Je suis sûr·e de ma réponse,Non,Ce chiffre semble trop petit par rapport à la réalité,16.234,69.493,72.461,4,Non affecté,Je suis sûr·e de ma réponse,Non,Beaucoup,Parfois,,,,De droite,,,,,,,,,,Je les comprends,,,Pas du tout favorable,Les Républicains,ce parti présente des candidats en qui j'ai confiance,2,8,6,2,7,9,3,3,8,4,8,"Le fait d'augmenter le prix du carburant ne résout en rien le problème du réchauffement climatique les solutions renouvelables ne peuvent pas être uniques il faut un mix des différente source sauf le charbon et le gaz qu'il faut éliminer , l'élimination du nucléaire est une faute lourde  le nucléaire sous un contrôle sans concession est une source économique",,160959275954246,1673,,1,Occ,0,0,1,68.9429999999999978399500832892954349517822265625,5,0,0,68.9429999999999978399500832892954349517822265625,14000,1,1,0,EELV,110
2020-10-19 13:34:37,2020-10-19 13:42:23,IP Address,109.210.197.226,100,466,True,2020-10-19 13:42:23,R_ukrniBMIp4IRJN7,,,,,43.95440673828125,4.8052978515625,anonymous,FR,84000,Féminin,25 à 34 ans,CDD,Employé·e,"Bac +2 (BTS, DUT, DEUG, écoles de formation sanitaires et sociales...)",2,30000,1500,2,2,Locataire,,,,Entre 60 001€ et 180 000€,50,Électricité,La marche ou le vélo,La voiture,La voiture,Deux ou plus,,,,,,Diesel,Diesel,Mes véhicules consomment ... Litres aux 100 km :,4.5,38000,,Il faudra modifier de façon importante nos modes de vie pour empêcher le changement climatique,,,européennes,Assez souhaitable,Pas vraiment souhaitable,Pas vraiment souhaitable,Pas vraiment souhaitable,Pas vraiment souhaitable,Pas vraiment souhaitable,Ne se prononce pas,,,,,,,,,Un peu,Principalement à des processus naturels,,,"Graves, car il y aurait plus de catastrophes naturelles",,,Les gouvernements,,,,"Non, probablement pas",Plusieurs fois par mois,21,Autant,,Des normes plus strictes sur l'isolation pour les nouveaux bâtiments,,,"Oui, je suis favorable à une augmentation de la taxe carbone",,,On n’est jamais assez prudent quand on a affaire aux autres,,,,,le sens de l’épargne,,,,,,,3,Peu souvent,2,1,4,Non,Plutôt pas confiance,"NSP (Ne sais pas, ne se prononce pas)","Oui, je sais assez bien ce que c'est",,"Oui, les mesures ont déjà été rendues publiques",,,Un espoir pour le renouveau des institutions,,,,,,,,,,Non,,,,Ils sont moins écologistes,,,,,,,,,,,,,,,0.661,0.901,1.518,2,"Non, je n'ai pas consacré toute mon attention aux questions jusqu'à présent et je pense que vous ne devriez pas utiliser mes réponses pour votre étude",Indifférent·e ou ne sais pas,"Non, pas vraiment",Indifférent·e ou ne sais pas,"Non, pas vraiment","Non, pas vraiment","Non, pas vraiment","Oui, plutôt",Indifférent·e ou ne sais pas,"Abstention, blanc ou nul",Non,"Abstention, blanc ou nul",Non,"Abstention, blanc ou nul","Abstention, blanc ou nul",Non,"Abstention, blanc ou nul","Abstention, blanc ou nul","Oui, il me semble","Non, ça ne me dit rien","Oui, il me semble","Non, ça ne me dit rien","Non, ça ne me dit rien",0.833,40.032,40.755,35,Mon ménage ne serait pas affecté financièrement (gain de 0€ par an),,,Je suis moyennement sûr·e de ma réponse,Non,Cette estimation semble correcte,0.264,3.401,4.052,10,Non affecté,Je ne suis pas vraiment sûr·e de ma réponse,Non,Un peu,Parfois,,,,,,Conservateur,,,,,,,,Je les comprends,,,Indifférent⋅e / Ne sais pas,Autres,ce parti présente des candidats en qui j'ai confiance,5,6,6,3,4,3,8,3,3,3,7,,,160959275911230,466,,4,PACA,0,0,2,193.838760000000007721610018052160739898681640625,5,0,193.838760000000007721610018052160739898681640625,0,38000,0,2,1,gouvernement,0
2020-10-19 13:26:56,2020-10-19 13:52:01,IP Address,88.142.55.21,100,1505,True,2020-10-19 13:52:01,R_2SesZ9JwGqaT70J,,,,,45.6667022705078125,0.5,anonymous,FR,16220,Féminin,50 à 64 ans,CDI,Ouvrier/ère,CAP ou BEP,1,1450,1450,1,1,Locataire,,,,Moins de 10 000€,90,"Bois, solaire, géothermie, aérothermie (pompe à chaleur)",La voiture,La voiture,La voiture,Deux ou plus,,,,,,Diesel,Essence,Mes véhicules consomment ... Litres aux 100 km :,6,13000,,,"C’est aux États de réglementer, au niveau mondial, le changement climatique",,à toutes les échelles,Pas vraiment souhaitable,Assez souhaitable,Pas vraiment souhaitable,Assez souhaitable,Pas vraiment souhaitable,Assez souhaitable,Ne se prononce pas,5,4,1,7,6,3,2,,Un peu,,est principalement dû à l'activité humaine,Les conditions de vie deviendront extrêmement pénibles à cause des dérèglements climatiques,,Chacun d'entre nous,,,,,,"Non, probablement pas",Presque jamais,80,Autant,L'obligation de rénovation thermique des logements les moins bien isolés assortie d'aides de l'État,Des normes plus strictes sur l'isolation pour les nouveaux bâtiments,,,,,"Non, je ne suis pas favorable à une augmentation de la taxe carbone",On n’est jamais assez prudent quand on a affaire aux autres,,la tolérance et le respect des autres,la générosité,,,l’obéissance,la responsabilité,,,l’imagination,,5,Peu souvent,7,5,7,Ça dépend qui et quels impôts,Plutôt pas confiance,Oui,"Non, je n'en ai jamais entendu parler",,,,,,,,,,,,,,,,,,,,,,,,,,,,,0,0,9.471,0,"Oui, j'ai consacré toute mon attention aux questions jusqu'à présent et je pense que vous devriez utiliser mes réponses pour votre étude",,,,,,"Oui, plutôt","Non, pas vraiment","Non, pas vraiment",Indifférent·e ou ne sais pas,"Non, pas du tout","Non, pas vraiment","Oui, plutôt",Indifférent·e ou ne sais pas,Oui,Oui,Non,Oui,Oui,Oui,"NSP (Ne sais pas, ne se prononce pas)",Non,Oui,,,,,,40.881,104.589,107.201,14,Mon ménage gagnerait environ (en € par an) :,85,,Je suis sûr·e de ma réponse,Oui,"NSP (Ne sais pas, ne se prononce pas)",19.907,57.722,59.981,9,Perdant,Je ne suis pas vraiment sûr·e de ma réponse,"NSP (Ne sais pas, ne se prononce pas)",Presque pas,Parfois,,,,,,,,,,Apolitique,,,,Je les comprends,,,Assez peu favorable,Aucun,Je ne sais pas ou je ne souhaite pas répondre,8,8,8,6,,6,,3,8,8,,,,160959274937352,1505,,1,SO,0,0,2,84.552519999999987021510605700314044952392578125,6,0,58.94511999999999574129105894826352596282958984375,25.6073999999999983856469043530523777008056640625,13000,1,0,1,gouvernement,170
2020-10-19 13:25:04,2020-10-19 13:54:08,IP Address,176.156.111.48,100,1743,True,2020-10-19 13:54:08,R_3k5IrDbbxsdwmPa,,,,,49.55029296875,3.54559326171875,anonymous,FR,80310,Masculin,50 à 64 ans,fonctionnaire,Profession intermédiaire,"Bac +2 (BTS, DUT, DEUG, écoles de formation sanitaires et sociales...)",4,3000,5500,3,2,,Propriétaire occupant,,,Entre 60 001€ et 180 000€,140,"Butane, propane, gaz en citerne",La voiture,La voiture,La voiture,Deux ou plus,,,,,,Diesel,Essence,Mes véhicules consomment ... Litres aux 100 km :,12,35000,,Il faudra modifier de façon importante nos modes de vie pour empêcher le changement climatique,,,mondiales,Assez souhaitable,Très souhaitable,Pas du tout souhaitable,Pas vraiment souhaitable,Pas vraiment souhaitable,Très souhaitable,Oui,3,2,1,4,6,5,7,,Un peu,,est principalement dû à la variabilité naturelle du climat,,"Graves, car il y aurait plus de catastrophes naturelles",,,Les gouvernements,,Les générations passées,,"Non, probablement pas",Plusieurs fois par an,70,Autant,L'obligation de rénovation thermique des logements les moins bien isolés assortie d'aides de l'État,,,,,"NSP (Ne sais pas, ne se prononce pas)",,On n’est jamais assez prudent quand on a affaire aux autres,,la tolérance et le respect des autres,,l’assiduité au travail,le sens de l’épargne,,la responsabilité,la détermination et la persévérance,,,,5,Assez souvent,9,6,9,Oui,Plutôt pas confiance,Oui,"Oui, je sais assez bien ce que c'est",donne des propositions,Je crois avoir entendu parler de mesures de la Convention mais je ne suis pas sûr·e,,,,Une expérience vouée à l’échec depuis le début,,,,,Une assemblée manipulée ou contrôlée par le gouvernement,,,,Non,,,Ils sont plus écologistes,,,,,,,,,,,,,,,,4.682,4.682,6.29,1,"Oui, j'ai consacré toute mon attention aux questions jusqu'à présent et je pense que vous devriez utiliser mes réponses pour votre étude","Oui, plutôt","Non, pas du tout","Non, pas vraiment","Oui, plutôt","Non, pas vraiment",Indifférent·e ou ne sais pas,Indifférent·e ou ne sais pas,"Oui, plutôt",Oui,Oui,Non,Oui,"Abstention, blanc ou nul",Oui,Oui,Oui,Oui,"Non, ça ne me dit rien","Non, ça ne me dit rien","Oui, il me semble","Oui, j'en suis sûr·e","Non, ça ne me dit rien",55.436,93.873,95.415,6,Mon ménage perdrait environ (en € par an) :,,400,Je suis sûr·e de ma réponse,Non,Cette estimation semble correcte,29.047,36.863,38.045,4,Non affecté,Je suis moyennement sûr·e de ma réponse,"NSP (Ne sais pas, ne se prononce pas)",Un peu,Parfois,,,,De droite,,,,,,,,J'en fais partie,Je les soutiens,,,,Indifférent⋅e / Ne sais pas,Debout la France,ce parti répond aux questions qui me semblent les plus importantes,7,8,6,2,,,6,6,9,3,,..,,160959269773345,1743,,1,Nord,1,0,2,665.26930399999992005177773535251617431640625,12,209.986503999999996494807419367134571075439453125,317.39679999999998472048901021480560302734375,137.885999999999995679900166578590869903564453125,35000,0,3,0,EELV,110
2020-10-19 13:35:23,2020-10-19 13:56:13,IP Address,82.253.64.26,100,1250,True,2020-10-19 13:56:13,R_1i3uCCC7dtlWMps,,,,,48.8533935546875,2.3488006591796875,anonymous,FR,75013,Féminin,50 à 64 ans,CDI,Employé·e,CAP ou BEP,1,1900,1900,1,1,Locataire,,,,Moins de 10 000€,25,"NSP (Ne sait pas, ne se prononce pas)",Les transports en commun,Les transports en commun,La voiture,Aucun,150,,,,,,,,,,,Il faudra modifier de façon importante nos modes de vie pour empêcher le changement climatique,,,à toutes les échelles,Assez souhaitable,Pas vraiment souhaitable,Assez souhaitable,Assez souhaitable,Pas vraiment souhaitable,Assez souhaitable,Non,3,,2,1,4,,5,,Un peu,,est principalement dû à l'activité humaine,Il y aura des modifications de climat mais on s'y adaptera sans trop de mal,,Chacun d'entre nous,,Les gouvernements,Certains pays étrangers,,,"Non, probablement pas",Plusieurs fois par an,80,Autant,L'obligation de rénovation thermique des logements les moins bien isolés assortie d'aides de l'État,Des normes plus strictes sur l'isolation pour les nouveaux bâtiments,Un renforcement du bonus/malus écologique pour l’achat d’un véhicule,,,,"NSP (Ne sais pas, ne se prononce pas)",On n’est jamais assez prudent quand on a affaire aux autres,,la tolérance et le respect des autres,la générosité,,,,la responsabilité,la détermination et la persévérance,l’expression personnelle,,,5,Peu souvent,8,8,6,"NSP (Ne sais pas, ne se prononce pas)",Plutôt confiance,"NSP (Ne sais pas, ne se prononce pas)",J'en ai entendu parler mais je ne sais pas très bien ce que c'est,,Je crois avoir entendu parler de mesures de la Convention mais je ne suis pas sûr·e,,,,,,,,,,Une assemblée représentative de la population,,,"NSP (Ne sais pas, ne se prononce pas)",,,,,,,,,"Non, ça ne me dit rien","Non, ça ne me dit rien","Non, ça ne me dit rien","Non, ça ne me dit rien","Non, ça ne me dit rien",8.665,8.665,13.078,1,"Oui, j'ai consacré toute mon attention aux questions jusqu'à présent et je pense que vous devriez utiliser mes réponses pour votre étude",,,,,,"Oui, tout à fait",Indifférent·e ou ne sais pas,Indifférent·e ou ne sais pas,"Oui, plutôt","Non, pas vraiment","Oui, plutôt","Non, pas vraiment",Indifférent·e ou ne sais pas,Oui,Oui,"Abstention, blanc ou nul","Abstention, blanc ou nul","NSP (Ne sais pas, ne se prononce pas)",Oui,"NSP (Ne sais pas, ne se prononce pas)",Non,Oui,,,,,,5.375,83.498,84.76,33,Mon ménage gagnerait environ (en € par an) :,109,,Je suis moyennement sûr·e de ma réponse,"NSP (Ne sais pas, ne se prononce pas)",Ce chiffre semble trop petit par rapport à la réalité,6.651,43.306,44.36,19,Perdant,Je suis moyennement sûr·e de ma réponse,"NSP (Ne sais pas, ne se prononce pas)",Presque pas,La moitié du temps,,,,,,,,,,Apolitique,,,,,Je m'y oppose,,Pas du tout favorable,Aucun,Je ne sais pas ou je ne souhaite pas répondre,10,10,10,10,7,5,,,1,,,,,160959269968945,1250,,5,IDF,0,0,0,1.083230055000000024989503799588419497013092041015625,7,0,0.543258629999999964610424285638146102428436279296875,0.53997142499999994935677705143461935222148895263671875,150,1,0,1,gouvernement,110
2020-10-19 13:38:50,2020-10-19 13:57:14,IP Address,78.237.30.63,100,1104,True,2020-10-19 13:57:15,R_1IiqjfCOMfPmcUO,,,,,43.435302734375,6.7357025146484375,anonymous,FR,83600,Masculin,65 ans ou plus,retraité·e,Retraité·e,"Bac +5 ou plus (master, école d'ingénieur ou de commerce, doctorat, médecine, maîtrise, DEA, DESS...)",2,3500,5500,2,2,,Propriétaire occupant,,,Plus de 550 001€,102,Électricité,Non concerné·e,La voiture,La voiture,Deux ou plus,,,,,,Électrique ou hybride,Essence,Mes véhicules consomment ... Litres aux 100 km :,5,15000,,Il faudra modifier de façon importante nos modes de vie pour empêcher le changement climatique,,,à toutes les échelles,Pas du tout souhaitable,Pas vraiment souhaitable,Pas du tout souhaitable,Assez souhaitable,Assez souhaitable,Très souhaitable,Non,3,1,4,6,5,2,7,,Un peu,,est principalement dû à l'activité humaine,Il y aura des modifications de climat mais on s'y adaptera sans trop de mal,,Chacun d'entre nous,,,,,,"Oui, probablement",Plusieurs fois par an,61,Beaucoup moins,L'obligation de rénovation thermique des logements les moins bien isolés assortie d'aides de l'État,,,,,,"Non, je ne suis pas favorable à une augmentation de la taxe carbone",On peut faire confiance à la plupart des gens,,la tolérance et le respect des autres,la générosité,,,,la responsabilité,la détermination et la persévérance,l’expression personnelle,,,1,Peu souvent,8,9,5,Oui,Pas du tout confiance,Non,"Oui, je sais assez bien ce que c'est","150 mesures prises par des citoyens pour la plupart incompétents. ","Oui, les mesures ont déjà été rendues publiques",Inutile car le gouvernement ne reprend que les mesures qui lui plaisent,,,Une expérience vouée à l’échec depuis le début,Une opération de communication du gouvernement,,,,,,,,Non,,,Ils sont plus écologistes,,Ils sont plus pro-gouvernement,,,,,,,,,,,,,,0.009,3.622,4.893,4,"Oui, j'ai consacré toute mon attention aux questions jusqu'à présent et je pense que vous devriez utiliser mes réponses pour votre étude","Oui, plutôt","Non, pas du tout","Oui, plutôt","Oui, plutôt","Non, pas vraiment","Non, pas du tout","Oui, plutôt","Oui, tout à fait",Oui,Non,Non,Oui,Non,Oui,Non,Oui,Oui,"Non, ça ne me dit rien","Non, ça ne me dit rien","Non, ça ne me dit rien","Oui, j'en suis sûr·e","Oui, il me semble",2.85,114.312,118.025,65,Mon ménage perdrait environ (en € par an) :,,2500,Je suis sûr·e de ma réponse,Non,Ce chiffre semble trop petit par rapport à la réalité,1.1,32.25,34.092,25,Perdant,Je suis sûr·e de ma réponse,Non,Beaucoup,Jamais,,,,,,Conservateur,,,,,,,,,Je m'y oppose,,Pas du tout favorable,Les Républicains,ce parti affiche des positions proches des miennes,1,8,5,5,7,1,9,9,8,4,9,,,160959271775321,1104,,3,PACA,0,0,2,73.8674999999999926103555480949580669403076171875,5,0,0,73.8674999999999926103555480949580669403076171875,15000,0,3,0,EELV,110
2020-10-19 13:56:24,2020-10-19 14:03:54,IP Address,109.11.66.179,100,450,True,2020-10-19 14:03:56,R_3qgQSbdNRYKpAQH,,,,,48.747894287109375,2.3925018310546875,anonymous,FR,94310,Féminin,18 à 24 ans,CDI,Employé·e,Baccalauréat,4,1200,4000,3,3,Locataire,,,,Entre 180 001€ et 350 000€,50,"Bois, solaire, géothermie, aérothermie (pompe à chaleur)",Les transports en commun,La voiture,La voiture,Un,,Diesel,Mon véhicule consomme ... Litres aux 100 km :,10,3769,,,,,,,,"C’est aux États de réglementer, au niveau mondial, le changement climatique",,européennes,Très souhaitable,Assez souhaitable,Pas vraiment souhaitable,Très souhaitable,Assez souhaitable,Pas vraiment souhaitable,Oui,4,2,6,5,1,0,2,5,Un peu,Uniquement à des processus naturels,,,"Graves, car il y aurait plus de catastrophes naturelles",,,Les gouvernements,,,,"Oui, certainement",Plusieurs fois par an,50,Beaucoup plus,,Des normes plus strictes sur l'isolation pour les nouveaux bâtiments,,,,,"Non, je ne suis pas favorable à une augmentation de la taxe carbone",On n’est jamais assez prudent quand on a affaire aux autres,,la tolérance et le respect des autres,,,,,,,,,,1,Peu souvent,9,2,6,Non,Plutôt confiance,Non,"Oui, je sais très bien ce que c'est","Je ne sais pas ",Je crois avoir entendu parler de mesures de la Convention mais je ne suis pas sûr·e,,,,,,Une initiative sincère du gouvernement en faveur de la démocratie,,,,Une assemblée représentative de la population,,,Oui,,,,,,,,,"Oui, j'en suis sûr·e","Non, ça ne me dit rien","Oui, il me semble","Oui, il me semble","Oui, j'en suis sûr·e",0,0,2.205,0,"Oui, j'ai consacré toute mon attention aux questions jusqu'à présent et je pense que vous devriez utiliser mes réponses pour votre étude",,,,,,"Non, pas vraiment","Non, pas vraiment",Indifférent·e ou ne sais pas,"Oui, plutôt","Oui, plutôt","Non, pas vraiment","Oui, plutôt","Oui, plutôt",Non,Oui,"Abstention, blanc ou nul",Non,"Abstention, blanc ou nul",Non,Non,Oui,Non,,,,,,0.845,37.698,39.834,16,Mon ménage perdrait environ (en € par an) :,,30000,Je suis moyennement sûr·e de ma réponse,Oui,Cette estimation semble correcte,0.018,7.786,8.943,8,Non affecté,Je suis sûr·e de ma réponse,Non,Un peu,La plupart du temps,,De gauche,,,,,,,,,,J'en fais partie,,,,,Assez favorable,Nouvelle donne,ce parti répond aux questions qui me semblent les plus importantes,8,6,2,7,1,1,1,7,4,3,3,Chez pas mais je pense,,160959275099201,450,,5,IDF,0,0,1,42.7238763999999946463503874838352203369140625,10,0,42.7238763999999946463503874838352203369140625,0,3769,1,0,1,EELV,170
