2020-10-19 11:42:26,2020-10-19 12:01:39,IP Address,109.213.152.212,100,1153,True,2020-10-19 12:01:39,R_1Flysb1Ly27Q0wW,,,,,44.377593994140625,4.701995849609375,anonymous,FR,26110,Masculin,65 ans ou plus,retraité·e,Retraité·e,Brevet des collèges,2,1460,2350,2,2,,Propriétaire occupant,,,Entre 180 001€ et 350 000€,82,"Bois, solaire, géothermie, aérothermie (pompe à chaleur)",Non concerné·e,La voiture,La voiture,Deux ou plus,,,,,,Diesel,Diesel,Mes véhicules consomment ... Litres aux 100 km :,12,15000,Le progrès technique permettra de trouver des solutions pour empêcher le changement climatique,,,,à toutes les échelles,Pas vraiment souhaitable,Assez souhaitable,Pas du tout souhaitable,Pas vraiment souhaitable,Pas vraiment souhaitable,Assez souhaitable,Non,,,,,,,,100,Un peu,Autant à des processus naturels qu'à l'activité humaine,,Les conditions de vie deviendront extrêmement pénibles à cause des dérèglements climatiques,,Chacun d'entre nous,,,,,,"Oui, probablement",Presque jamais,35,Un peu moins,,Des normes plus strictes sur l'isolation pour les nouveaux bâtiments,,,"Non, je ne suis pas favorable à une augmentation de la taxe carbone",,,On n’est jamais assez prudent quand on a affaire aux autres,,la tolérance et le respect des autres,,l’assiduité au travail,,,,la détermination et la persévérance,,l’imagination,,5,Peu souvent,5,5,6,Ça dépend qui et quels impôts,Plutôt pas confiance,"NSP (Ne sais pas, ne se prononce pas)",J'en ai entendu parler mais je ne sais pas très bien ce que c'est,Se sont réunis pour trouver des solutions ou des des contraintes pour réduire le réchauffement climatique,Je crois avoir entendu parler de mesures de la Convention mais je ne suis pas sûr·e,,,,,Une opération de communication du gouvernement,,Une façon pour le gouvernement de se défausser de ses responsabilités,,,,,,Non,,,Ils sont plus écologistes,,,,,,"Oui, il me semble","Oui, il me semble","Non, ça ne me dit rien","Oui, il me semble","Non, ça ne me dit rien",0,0,9.566,0,"Oui, j'ai consacré toute mon attention aux questions jusqu'à présent et je pense que vous devriez utiliser mes réponses pour votre étude",,,,,,"Oui, plutôt","Non, pas du tout","Non, pas vraiment",Indifférent·e ou ne sais pas,"Non, pas du tout","Non, pas vraiment","Non, pas vraiment","Non, pas du tout",Oui,"Abstention, blanc ou nul",Non,Oui,Non,"Abstention, blanc ou nul","Abstention, blanc ou nul","Abstention, blanc ou nul",Oui,,,,,,2.48,71.049,72.407,9,Mon ménage ne serait pas affecté financièrement (gain de 0€ par an),,,Je suis moyennement sûr·e de ma réponse,Non,Ce chiffre semble trop petit par rapport à la réalité,2.458,58.329,59.458,9,Perdant,Je suis moyennement sûr·e de ma réponse,Non,Presque pas,Parfois,,De gauche,,,,,,,,,,,Je les soutiens,,,,Assez peu favorable,Parti socialiste,ce parti affiche des positions proches des miennes,8,8,8,7,8,4,7,5,7,3,8,Néant,,160959271016516,1153,,1,ARA,0,0,2,204.040799999999990177457220852375030517578125,12,0,204.040799999999990177457220852375030517578125,0,15000,1,0,0,gouvernement,170
2020-10-19 11:44:07,2020-10-19 12:03:43,IP Address,92.150.123.164,100,1175,True,2020-10-19 12:03:43,R_bdzX2fS3maftoKB,,,,,43.2949981689453125,5.572601318359375,anonymous,FR,13600,Féminin,25 à 34 ans,CDI,Employé·e,Baccalauréat,2,1200,2400,2,2,Locataire,,,,Moins de 10 000€,60,Électricité,La voiture,La voiture,La voiture,Deux ou plus,,,,,,Diesel,Diesel,Mes véhicules consomment ... Litres aux 100 km :,6,180000,,Il faudra modifier de façon importante nos modes de vie pour empêcher le changement climatique,,,mondiales,Très souhaitable,Très souhaitable,Très souhaitable,Très souhaitable,Très souhaitable,Très souhaitable,Oui,3,4,7,5,1,2,6,,Un peu,,est principalement dû à l'activité humaine,Les conditions de vie deviendront extrêmement pénibles à cause des dérèglements climatiques,,Chacun d'entre nous,,Les gouvernements,,,,"Non, probablement pas",Presque jamais,60,Autant,,Des normes plus strictes sur l'isolation pour les nouveaux bâtiments,,,,,"Oui, je suis favorable à une augmentation de la taxe carbone",On n’est jamais assez prudent quand on a affaire aux autres,l’indépendance,la tolérance et le respect des autres,la générosité,,,l’obéissance,la responsabilité,,,,,5,Assez souvent,6,8,8,Ça dépend qui et quels impôts,Plutôt pas confiance,"NSP (Ne sais pas, ne se prononce pas)",J'en ai entendu parler mais je ne sais pas très bien ce que c'est,,Aucune mesure n'a été révélée à ma connaissance,,Une méthode prometteuse pour définir la politique climatique de la France,,,,,,,,,,,"NSP (Ne sais pas, ne se prononce pas)",,,,,,,,,,,,,,0,0,2.586,0,"Oui, j'ai consacré toute mon attention aux questions jusqu'à présent et je pense que vous devriez utiliser mes réponses pour votre étude",,,,,,"Oui, plutôt","Non, pas vraiment",Indifférent·e ou ne sais pas,"Oui, plutôt","Non, pas vraiment","Oui, plutôt","Oui, plutôt","Oui, plutôt","Abstention, blanc ou nul","Abstention, blanc ou nul",Non,Oui,Oui,Oui,Non,Non,Oui,,,,,,4.738,52.932,53.481,19,Mon ménage ne serait pas affecté financièrement (gain de 0€ par an),,,Je suis sûr·e de ma réponse,Non,"NSP (Ne sais pas, ne se prononce pas)",3.73,17.562,18.098,12,Non affecté,Je suis moyennement sûr·e de ma réponse,"NSP (Ne sais pas, ne se prononce pas)",Presque pas,Parfois,,,,,D'extrême droite,,,,,,,,,Je les comprends,,,Très favorable,Préfère ne pas répondre,ce parti répond aux questions qui me semblent les plus importantes,7,7,7,7,7,6,6,5,5,7,4,,,160959275960435,1175,,4,PACA,0,0,2,1224.24479999999994106474332511425018310546875,6,0,1224.24479999999994106474332511425018310546875,0,180000,1,0,0,EELV,110
2020-10-19 11:44:37,2020-10-19 12:04:39,IP Address,109.220.104.74,100,1202,True,2020-10-19 12:04:40,R_3puuNQ55pBQgUt6,,,,,46.087799072265625,2.039794921875,anonymous,FR,23600,Masculin,65 ans ou plus,retraité·e,Retraité·e,"Bac +2 (BTS, DUT, DEUG, écoles de formation sanitaires et sociales...)",2,3000,3500,2,2,,Propriétaire occupant,Propriétaire bailleur,,Entre 60 001€ et 180 000€,185,Électricité,La voiture,La voiture,La voiture,Deux ou plus,,,,,,Diesel,Diesel,Mes véhicules consomment ... Litres aux 100 km :,6,20000,,Il faudra modifier de façon importante nos modes de vie pour empêcher le changement climatique,,,mondiales,Assez souhaitable,Très souhaitable,Pas du tout souhaitable,Pas vraiment souhaitable,Pas vraiment souhaitable,Assez souhaitable,Oui,1,3,1,2,5,5,3,3,Un peu,,est principalement dû à l'activité humaine,,"Graves, car il y aurait plus de catastrophes naturelles",Chacun d'entre nous,,,,,,"Non, probablement pas",Plusieurs fois par an,62,Un peu plus,,Des normes plus strictes sur l'isolation pour les nouveaux bâtiments,,,"NSP (Ne sais pas, ne se prononce pas)",,,On n’est jamais assez prudent quand on a affaire aux autres,,la tolérance et le respect des autres,,l’assiduité au travail,,,,,,,,2,Assez souvent,8,8,6,Oui,Pas du tout confiance,Non,J'en ai entendu parler mais je ne sais pas très bien ce que c'est,ne sait pas,Aucune mesure n'a été révélée à ma connaissance,,,Un espoir pour le renouveau des institutions,,,,,,,,,,"NSP (Ne sais pas, ne se prononce pas)",,,,,,,,,,,,,,,,,,,11.877,14.827,16.648,2,"Oui, j'ai consacré toute mon attention aux questions jusqu'à présent et je pense que vous devriez utiliser mes réponses pour votre étude",Indifférent·e ou ne sais pas,"Non, pas vraiment","Oui, plutôt","Oui, plutôt","Non, pas vraiment","Oui, plutôt","Oui, tout à fait",Indifférent·e ou ne sais pas,Oui,Oui,Oui,Oui,Non,Oui,Oui,Oui,Oui,,,,,,13.7,80.736,82.764,16,Mon ménage ne serait pas affecté financièrement (gain de 0€ par an),,,Je suis moyennement sûr·e de ma réponse,Non,"NSP (Ne sais pas, ne se prononce pas)",15.113,35.881,37.632,7,Non affecté,Je suis moyennement sûr·e de ma réponse,Non,Un peu,La plupart du temps,,De gauche,,,,,,,,,,,,Je les comprends,,,Indifférent⋅e / Ne sais pas,Parti socialiste,ce parti affiche des positions proches des miennes,9,9,5,4,4,2,3,4,7,4,8,,,160959271116883,1202,,2,SO,0,0,2,136.02719999999999345163814723491668701171875,6,0,136.02719999999999345163814723491668701171875,0,20000,0,0,0,EELV,170
2020-10-19 11:45:06,2020-10-19 12:04:43,IP Address,90.52.165.51,100,1176,True,2020-10-19 12:04:44,R_DqSDU6pA5YHygAp,,,,,45.043701171875,3.88519287109375,anonymous,FR,43230,Masculin,50 à 64 ans,retraité·e,Retraité·e,Baccalauréat,2,1750,1750,2,2,,Propriétaire occupant,,,Entre 10 001€ et 60 000€,110,Électricité,Non concerné·e,La voiture,La voiture,Un,,Essence,Mon véhicule consomme ... Litres aux 100 km :,5,9000,,,,,,,Il faudra modifier de façon importante nos modes de vie pour empêcher le changement climatique,,,à toutes les échelles,Assez souhaitable,Assez souhaitable,Assez souhaitable,Assez souhaitable,Assez souhaitable,Très souhaitable,Ne se prononce pas,4,1,2,6,5,3,7,,Un peu,Autant à des processus naturels qu'à l'activité humaine,,Il y aura des modifications de climat mais on s'y adaptera sans trop de mal,,,Les plus riches,Les gouvernements,Certains pays étrangers,,Des causes naturelles,"Oui, probablement",Plusieurs fois par an,21,Beaucoup moins,L'obligation de rénovation thermique des logements les moins bien isolés assortie d'aides de l'État,,,,,"Non, je ne suis pas favorable à une augmentation de la taxe carbone",,On peut faire confiance à la plupart des gens,,la tolérance et le respect des autres,la générosité,,,l’obéissance,la responsabilité,,,,,3,Peu souvent,5,4,6,Oui,Plutôt confiance,"NSP (Ne sais pas, ne se prononce pas)",J'en ai entendu parler mais je ne sais pas très bien ce que c'est,pas grand chose,Aucune mesure n'a été révélée à ma connaissance,Inutile car le gouvernement ne reprend que les mesures qui lui plaisent,,,,,,,,,,,,Non,Ils sont plus à gauche politiquement,,,,Ils sont plus pro-gouvernement,,,,,,,,,,,,,,24.189,24.189,26.064,1,"Oui, j'ai consacré toute mon attention aux questions jusqu'à présent et je pense que vous devriez utiliser mes réponses pour votre étude","Oui, plutôt","Non, pas du tout",Indifférent·e ou ne sais pas,"Oui, tout à fait","Non, pas du tout","Non, pas du tout","Oui, tout à fait","Non, pas du tout",Oui,Oui,Oui,Oui,Oui,Oui,Oui,Non,"Abstention, blanc ou nul",,,,,,89.423,110.205,112.128,4,Mon ménage gagnerait environ (en € par an) :,200,,Je suis moyennement sûr·e de ma réponse,Non,Ce chiffre semble trop petit par rapport à la réalité,64.371,70.125,71.99,3,Perdant,Je suis moyennement sûr·e de ma réponse,Non,Presque pas,Parfois,,,,De droite,,,,,Patriote,,,,,,Je m'y oppose,,Pas du tout favorable,Rassemblement National,ce parti répond aux questions qui me semblent les plus importantes,10,10,10,4,5,1,2,0,8,3,8,rien à dire,,160959271217254,1176,,1,ARA,0,0,1,44.3204999999999955662133288569748401641845703125,5,0,0,44.3204999999999955662133288569748401641845703125,9000,0,2,0,gouvernement,170
2020-10-19 11:50:55,2020-10-19 12:07:13,IP Address,89.84.118.70,100,978,True,2020-10-19 12:07:15,R_2akMDJTAedr6lnq,,,,,48.757904052734375,2.0514068603515625,anonymous,FR,78960,Masculin,50 à 64 ans,retraité·e,Retraité·e,"Bac +2 (BTS, DUT, DEUG, écoles de formation sanitaires et sociales...)",2,3300,3900,2,2,,Propriétaire occupant,,,Entre 60 001€ et 180 000€,125,Gaz de ville,Non concerné·e,La voiture,La voiture,Deux ou plus,,,,,,Diesel,Électrique ou hybride,Mes véhicules consomment ... Litres aux 100 km :,11,17000,Le progrès technique permettra de trouver des solutions pour empêcher le changement climatique,Il faudra modifier de façon importante nos modes de vie pour empêcher le changement climatique,,,mondiales,Pas vraiment souhaitable,Assez souhaitable,Pas du tout souhaitable,Très souhaitable,Pas du tout souhaitable,Pas vraiment souhaitable,Oui,1,2,3,4,7,6,5,,Un peu,Principalement à l'activité humaine,,,"Graves, car il y aurait plus de catastrophes naturelles",Chacun d'entre nous,,,,,,"Oui, probablement",Plusieurs fois par an,70,Un peu plus,L'obligation de rénovation thermique des logements les moins bien isolés assortie d'aides de l'État,Des normes plus strictes sur l'isolation pour les nouveaux bâtiments,,,"Non, je ne suis pas favorable à une augmentation de la taxe carbone",,,On peut faire confiance à la plupart des gens,,la tolérance et le respect des autres,la générosité,,,l’obéissance,la responsabilité,la détermination et la persévérance,,,,5,Assez souvent,5,4,5,Oui,Plutôt pas confiance,Oui,J'en ai entendu parler mais je ne sais pas très bien ce que c'est,Rien,Aucune mesure n'a été révélée à ma connaissance,Inutile car le gouvernement ne reprend que les mesures qui lui plaisent,,,,Une opération de communication du gouvernement,,,,,,,,Non,,,Ils sont plus écologistes,,,,,,,,,,,,,,,,18.491,18.491,19.5,1,"Oui, j'ai consacré toute mon attention aux questions jusqu'à présent et je pense que vous devriez utiliser mes réponses pour votre étude","Oui, plutôt","Non, pas vraiment","Oui, plutôt","Oui, plutôt","Non, pas vraiment",Indifférent·e ou ne sais pas,"Oui, plutôt",Indifférent·e ou ne sais pas,Oui,Oui,"Abstention, blanc ou nul",Oui,Non,Oui,"NSP (Ne sais pas, ne se prononce pas)","Abstention, blanc ou nul","Abstention, blanc ou nul",,,,,,17.697,97.644,98.702,23,Mon ménage perdrait environ (en € par an) :,,170,Je suis moyennement sûr·e de ma réponse,Non,Cette estimation semble correcte,4.596,34.173,35.048,9,Perdant,Je suis sûr·e de ma réponse,Non,Un peu,Parfois,,,Du centre,,,,,,,,,,Je les soutiens,,,,Pas du tout favorable,UDI,ce parti affiche des positions proches des miennes,8,8,6,2,5,,6,4,7,6,7,,,160959274651718,978,,5,IDF,1,0,2,390.1971966666666276069008745253086090087890625,11,187.487949999999983674570103175938129425048828125,141.317146666666673127110698260366916656494140625,61.392099999999999226929503493010997772216796875,17000,0,0,1,gouvernement,110
2020-10-19 11:49:45,2020-10-19 12:07:45,IP Address,92.135.245.115,100,1080,True,2020-10-19 12:07:46,R_25Y17h89o6e2pRX,,,,,47.7064971923828125,-3.3834075927734375,anonymous,FR,56110,Féminin,50 à 64 ans,CDI,Employé·e,Baccalauréat,2,1500,3000,2,2,,Propriétaire occupant,,,Entre 60 001€ et 180 000€,120,"Butane, propane, gaz en citerne",La voiture,La voiture,La voiture,Deux ou plus,,,,,,Diesel,Essence,Mes véhicules consomment ... Litres aux 100 km :,5,15000,,,"C’est aux États de réglementer, au niveau mondial, le changement climatique",,à toutes les échelles,Assez souhaitable,Assez souhaitable,Pas vraiment souhaitable,Assez souhaitable,Assez souhaitable,Très souhaitable,Oui,1,2,3,6,5,4,7,,Un peu,,est principalement dû à l'activité humaine,Il y aura des modifications de climat mais on s'y adaptera sans trop de mal,,Chacun d'entre nous,,,,,,"Non, probablement pas",Plusieurs fois par an,50,Un peu moins,L'obligation de rénovation thermique des logements les moins bien isolés assortie d'aides de l'État,Des normes plus strictes sur l'isolation pour les nouveaux bâtiments,,,"NSP (Ne sais pas, ne se prononce pas)",,,On n’est jamais assez prudent quand on a affaire aux autres,,la tolérance et le respect des autres,,l’assiduité au travail,le sens de l’épargne,,la responsabilité,la détermination et la persévérance,,,,5,Assez souvent,8,6,5,Ça dépend qui et quels impôts,Plutôt pas confiance,"NSP (Ne sais pas, ne se prononce pas)",J'en ai entendu parler mais je ne sais pas très bien ce que c'est,"Rien en fait ! ",Aucune mesure n'a été révélée à ma connaissance,,,,,Une opération de communication du gouvernement,,,Une opportunité pour faire entendre la voix de l’ensemble des Français,,Une assemblée représentative de la population,,,"NSP (Ne sais pas, ne se prononce pas)",,,,,,,,,,,,,,,,,,,19.463,19.463,21.123,1,"Oui, j'ai consacré toute mon attention aux questions jusqu'à présent et je pense que vous devriez utiliser mes réponses pour votre étude","Oui, plutôt","Oui, plutôt","Oui, tout à fait","Oui, plutôt","Non, pas du tout",Indifférent·e ou ne sais pas,"Oui, plutôt","Oui, plutôt",Oui,"NSP (Ne sais pas, ne se prononce pas)",Oui,Oui,Non,Oui,"NSP (Ne sais pas, ne se prononce pas)","Abstention, blanc ou nul",Non,,,,,,15.155,100.646,101.601,20,Mon ménage perdrait environ (en € par an) :,,41,Je suis sûr·e de ma réponse,Oui,Cette estimation semble correcte,16.473,54.295,62.335,17,Non affecté,Je ne suis pas du tout sûr·e de ma réponse,Non,Un peu,La plupart du temps,,De gauche,,,,,,,,,,,,,Je m'y oppose,,Pas du tout favorable,Parti socialiste,ce parti affiche des positions proches des miennes,9,9,6,7,7,5,4,6,5,6,5,"Merci, très intéressant ! ",,160959272015879,1080,,2,Ouest,1,0,2,261.28893199999998842031345702707767486572265625,5,179.9884319999999888750608079135417938232421875,56.6779999999999972715158946812152862548828125,24.622499999999998721023075631819665431976318359375,15000,0,0,0,gouvernement,110
2020-10-19 11:52:09,2020-10-19 12:10:10,IP Address,91.160.24.113,100,1080,True,2020-10-19 12:10:10,R_27lG8MIUJEKXIKY,,,,,50.61669921875,3.166595458984375,anonymous,FR,59650,Féminin,25 à 34 ans,fonctionnaire,Profession intermédiaire,Bac +3 (licence...),3,1800,3000,3,3,,,,Hébergé gratuitement,NSP (Ne souhaite pas répondre),80,Gaz de ville,La marche ou le vélo,La voiture,La marche ou le vélo,Un,,Essence,Mon véhicule consomme ... Litres aux 100 km :,7,500,,,,,,,Il faudra modifier de façon importante nos modes de vie pour empêcher le changement climatique,,,à toutes les échelles,Très souhaitable,Très souhaitable,Pas du tout souhaitable,Très souhaitable,Très souhaitable,Très souhaitable,Oui,1,2,3,7,4,5,6,,Un peu,Principalement à l'activité humaine,,,"Cataclysmiques, l'humanité disparaîtrait",Chacun d'entre nous,,Les gouvernements,,Les générations passées,,"Non, certainement pas",Plusieurs fois par mois,31,Beaucoup plus,,,Un renforcement du bonus/malus écologique pour l’achat d’un véhicule,,"Non, je ne suis pas favorable à une augmentation de la taxe carbone",,,On n’est jamais assez prudent quand on a affaire aux autres,,la tolérance et le respect des autres,,,,,la responsabilité,la détermination et la persévérance,l’expression personnelle,l’imagination,,5,Jamais,10,10,0,Oui,Plutôt pas confiance,Oui,J'en ai entendu parler mais je ne sais pas très bien ce que c'est,"Ce sont des personnes tirés au sort dans la population qui acceptent d'échanger sur le climat et ses dérivés. Des échanges, il en sort des propositions transmises au gouvernement.","Oui, les mesures ont déjà été rendues publiques",,,Un espoir pour le renouveau des institutions,,Une opération de communication du gouvernement,,,Une opportunité pour faire entendre la voix de l’ensemble des Français,,,,,Non,,,,,,,Autre,Certains semblent loin de la réalité de terrain,"Oui, il me semble","Oui, il me semble","Non, ça ne me dit rien","Oui, il me semble","Non, je suis sûr·e que non",6.625,8.278,11.03,3,"Oui, j'ai consacré toute mon attention aux questions jusqu'à présent et je pense que vous devriez utiliser mes réponses pour votre étude",,,,,,"Oui, tout à fait","Oui, tout à fait","Oui, tout à fait","Oui, tout à fait","Non, pas du tout","Oui, plutôt","Non, pas du tout","Non, pas du tout",Oui,Oui,Oui,Oui,"NSP (Ne sais pas, ne se prononce pas)",Oui,Oui,Oui,Oui,,,,,,9.89,72.818,73.716,23,Mon ménage perdrait environ (en € par an) :,,300,Je ne suis pas du tout sûr·e de ma réponse,Non,Ce chiffre semble trop petit par rapport à la réalité,2.792,19.201,19.874,9,Perdant,Je ne suis pas du tout sûr·e de ma réponse,"NSP (Ne sais pas, ne se prononce pas)",Un peu,Parfois,,,,,,,,,,,Écologiste,,,Je les comprends,,,Pas du tout favorable,Aucun,ce parti répond aux questions qui me semblent les plus importantes,10,10,,0,,0,10,0,10,10,10,,,160959275959398,1080,,4,Nord,1,0,1,123.4394379999999813435351825319230556488037109375,7,119.9922879999999878464223002083599567413330078125,0,3.44714999999999971436182022443972527980804443359375,500,1,3,1,EELV,110
2020-10-19 11:51:08,2020-10-19 12:11:48,IP Address,212.129.55.203,100,1239,True,2020-10-19 12:11:48,R_3HuxlC9lr9bXcCB,,,,,48.8582000732421875,2.3386993408203125,anonymous,FR,91120,Féminin,50 à 64 ans,au chômage,Employé·e,CAP ou BEP,3,1000,4000,3,3,,Propriétaire occupant,,,Entre 350 001€ et 550 000€,100,Gaz de ville,Non concerné·e,La voiture,La voiture,Deux ou plus,,,,,,Essence,Diesel,"NSP (Ne sais pas, ne se prononce pas)",,20000,,Il faudra modifier de façon importante nos modes de vie pour empêcher le changement climatique,,,à toutes les échelles,Pas du tout souhaitable,Assez souhaitable,Pas du tout souhaitable,Pas du tout souhaitable,Très souhaitable,Très souhaitable,Ne se prononce pas,1,7,2,4,5,3,6,,Un peu,Autant à des processus naturels qu'à l'activité humaine,,,"Graves, car il y aurait plus de catastrophes naturelles",Chacun d'entre nous,,,,,,"Non, probablement pas",Presque jamais,19,Autant,,Des normes plus strictes sur l'isolation pour les nouveaux bâtiments,,,"NSP (Ne sais pas, ne se prononce pas)",,,On peut faire confiance à la plupart des gens,l’indépendance,la tolérance et le respect des autres,,l’assiduité au travail,,,la responsabilité,la détermination et la persévérance,,,,8,Peu souvent,10,7,8,Oui,Plutôt confiance,"NSP (Ne sais pas, ne se prononce pas)",J'en ai entendu parler mais je ne sais pas très bien ce que c'est,pas grand choses,Aucune mesure n'a été révélée à ma connaissance,,,,,,,,,,,Autre :,aucunes idees,"NSP (Ne sais pas, ne se prononce pas)",,,,,,,,,,,,,,,,,,,21.304,21.304,23.275,1,"Oui, j'ai consacré toute mon attention aux questions jusqu'à présent et je pense que vous devriez utiliser mes réponses pour votre étude","Non, pas vraiment","Non, pas vraiment","Non, pas vraiment","Oui, plutôt","Non, pas du tout",Indifférent·e ou ne sais pas,"Oui, tout à fait",Indifférent·e ou ne sais pas,Oui,Oui,Non,Non,Oui,Oui,Oui,Non,Non,,,,,,36.493,61.809,63.767,4,Mon ménage ne serait pas affecté financièrement (gain de 0€ par an),,,Je ne suis pas vraiment sûr·e de ma réponse,"NSP (Ne sais pas, ne se prononce pas)",Ce chiffre semble trop petit par rapport à la réalité,46.275,52.816,53.951,3,Non affecté,Je ne suis pas vraiment sûr·e de ma réponse,"NSP (Ne sais pas, ne se prononce pas)",Presque pas,Jamais,,,,,,Conservateur,,,Patriote,,,,,Je les comprends,,,Pas du tout favorable,Aucun,Je ne sais pas ou je ne souhaite pas répondre,8,8,5,5,5,2,2,5,5,5,5,aucuns,,159951243713564,1239,,5,IDF,1,0,2,294.274936000000025160261429846286773681640625,7,149.990359999999981255314196459949016571044921875,48.28965600000000080171957961283624172210693359375,95.994920000000007576090865768492221832275390625,20000,0,1,0,gouvernement,170
2020-10-19 11:44:50,2020-10-19 12:12:14,IP Address,80.214.69.25,100,1644,True,2020-10-19 12:12:15,R_2Pjx5h61XPxIapT,,,,,48.8533935546875,2.3488006591796875,anonymous,FR,92410,Masculin,50 à 64 ans,CDI,Employé·e,CAP ou BEP,2,1203,1203,2,2,Locataire,,,,Moins de 10 000€,14,Autre,Les transports en commun,Les transports en commun,La marche ou le vélo,Aucun,1900,,,,,,,,,,,Il faudra modifier de façon importante nos modes de vie pour empêcher le changement climatique,"C’est aux États de réglementer, au niveau mondial, le changement climatique","Il n’y a rien à faire, le changement climatique est inévitable",à toutes les échelles,Très souhaitable,Très souhaitable,Pas vraiment souhaitable,Très souhaitable,Pas vraiment souhaitable,Très souhaitable,Oui,4,5,2,7,1,6,3,,Un peu,Principalement à l'activité humaine,,Les conditions de vie deviendront extrêmement pénibles à cause des dérèglements climatiques,,Chacun d'entre nous,,,,Les générations passées,Des causes naturelles,"Non, certainement pas",Presque jamais,75,Beaucoup plus,L'obligation de rénovation thermique des logements les moins bien isolés assortie d'aides de l'État,Des normes plus strictes sur l'isolation pour les nouveaux bâtiments,Un renforcement du bonus/malus écologique pour l’achat d’un véhicule,,,"Non, je ne suis pas favorable à une augmentation de la taxe carbone",,On n’est jamais assez prudent quand on a affaire aux autres,l’indépendance,,la générosité,,,,,,l’expression personnelle,l’imagination,,0,Assez souvent,10,8,10,Ça dépend qui et quels impôts,Plutôt pas confiance,Oui,"Non, je n'en ai jamais entendu parler",,,,,,,,,,,,,,,,,,,,,,,,,,,,,,,,,,1.371,113.192,114.479,30,"Oui, j'ai consacré toute mon attention aux questions jusqu'à présent et je pense que vous devriez utiliser mes réponses pour votre étude","Oui, tout à fait",Indifférent·e ou ne sais pas,"Oui, tout à fait","Oui, plutôt","Oui, plutôt","Oui, tout à fait","Oui, plutôt","Oui, tout à fait",Oui,Oui,Oui,"NSP (Ne sais pas, ne se prononce pas)",Oui,Oui,Oui,Oui,Oui,,,,,,65.151,173.699,174.5,40,Mon ménage perdrait environ (en € par an) :,,150,Je suis moyennement sûr·e de ma réponse,Oui,Ce chiffre semble trop petit par rapport à la réalité,9.395,66.969,68.279,26,Perdant,Je suis sûr·e de ma réponse,Oui,Presque pas,La plupart du temps,,,,,,,,,,Apolitique,,,,,Je m'y oppose,,Pas du tout favorable,Aucun,ce parti représente les gens comme moi,9,10,10,3,7,3,6,6,6,8,9,Rien en particulier à dire .,,160959272861787,1644,,5,IDF,0,0,0,13.720914029999999428355295094661414623260498046875,7,0,6.8812759799999998477915141847915947437286376953125,6.83963804999999869238536120974458754062652587890625,1900,0,1,0,EELV,0
